story_key,comparison_type,variant,semantic_similarity_sbert,delta_cli,delta_aoa,delta_concreteness,delta_imageability,delta_fk_grade,delta_mtld,delta_tier2_proxy_token_ratio,tier2_types_retained,tier2_types_removed,tier2_types_added,low_frequency_tier2_types_retained
wnl school sports,human_reference,human::elementary,,0.002795306283582419,6.814622641509459,2.9837398373983888,4.740599915504902,-1.6173197357608835,-26.607591831895007,-0.010596216515340942,academic; activity; adult; class; coordination; depend; develop; development; example; experience; explanation; factor; international; introduction; level; likely; performance; predict; quality; research; selection; state; study; tested; university,combined; competing; disproportionately; effect; ensure; excluded; individual; journal; known; linked; maturity; overall; plausible; potentially; published; range; relative; science; suggest; vital,expert,academic; coordination; depend; develop; development; example; experience; explanation; factor; international; introduction; predict; research; selection; state; tested; university
wnl scientist,human_reference,human::elementary,,0.3504719347472348,-13.666666666666686,5.820530344450503,3.2437387731505396,-4.181771080783594,-27.0958587198286,-0.03835467471386238,central; collected; common; diversity; helpful; human; research; study; system,both; catalogue; conclude; continued; distinct; distinctive; essential; expected; ferment; instance; journal; likely; localized; map; note; potentially; prevalent; process; provide; published; represent; scale; short; strongly; suggest; various; waste; wealth,tested,central; collected; helpful
wnl scottish referendum,human_reference,human::elementary,,-0.16580703077841863,-0.15867003367003463,-6.114751887810144,-5.523809523809518,-3.0829912663755508,-18.481330317041852,-0.019007691744825174,accepted; change; expected; general; importantly; independence; population; radical; result; settlement; western; whole,authoritative; both; desire; enhanced; focus; further; future; however; important; increase; interest; potentially; revolution; shared; support; vital; within,total,accepted; expected; general; importantly; population; radical; western; whole
wnl seaworld,human_reference,human::elementary,,0.19030540998921475,-14.938069216757754,-3.5376584638329405,-0.033432638199258236,-5.129029980551671,-15.944404811706164,-0.03818308246073299,ethical; future; increase; positive; report; theme,base; changing; commitment; continued; contributing; detailed; focus; following; historical; however; improve; net; perform; performance; quarterly; recognize; reported; require; sustained; table; traditionally; value; vision,act; organization; presentation; reduced,ethical; future; increase; positive; report; theme
wnl shakespeare,human_reference,human::elementary,,0.22457426723351115,-9.848617814831073,1.590560105293946,2.923092131277201,-3.550338805040912,-38.5366930075193,-0.013079915613447651,display; educated; evidence; general; history; importance; important; include; international; marked; production; published; research; traditional,academic; century; claim; consistently; heritage; however; jointly; known; project; prompt; range; spurious; university; whole,collected,evidence; general; history; important; include; international; production; published; research; traditional
wnl ships noise,human_reference,human::elementary,,0.0085993081225475,-13.969052224371353,-11.952059976614635,-3.2263520118875135,-3.1714016232295243,-23.265591594057497,-0.04439779214039723,increase; known; level; low; measure; need; reduce; research; scarce; sound; state; study; technology; use,affect; attempt; class; communicate; communication; concern; connected; critically; decreasing; determine; disturbance; documented; effectively; environment; equivalent; group; identify; impact; improved; increased; individual; intensity; persistent; population; previously; problematic; process; range; straightforward; suggest; vessel,communicating; effect,increase; level; measure; scarce; state; technology; use
wnl shocking,human_reference,human::elementary,,0.029845670114680534,-7.3890977443609245,-4.319070315428689,-1.9038429490384488,-1.5770353807449133,-23.529167914777105,0.0010652008874712376,experience; experiment; modern; report; result; separate; social; study; task; university,attempt; challenge; difference; effect; given; informed; known; rate; regardless; science; sound; striking; tend; test,need; period; researcher; similar; use,modern; report; result; separate; university
wnl shops,human_reference,human::elementary,,-0.013059561051711244,-8.922719734660006,-2.664566495756219,-8.01556852933004,-2.085740011291513,-12.884956010896346,-0.011506326668598466,accuracy; aim; developed; female; focused; identify; information; intrusive; male; need; particular; predict; present; recognition; report; similar; survey; system; technology; type; use; word,acceptance; belief; calculated; categorize; change; collected; consent; data; database; exist; experience; express; familiarity; focus; generalized; however; interest; monitoring; openness; output; perspective; previous; provide; relative; social; stem; targeted; whole,example; general; section,accuracy; developed; female; focused; present; similar; survey; type; word
wnl six year olds,human_reference,human::elementary,,0.1882473298324852,-4.515384615384619,4.789215686274531,3.2264810577167395,-3.091195030444677,-35.033023749958176,-0.0008645388288514577,adult; change; communicating; communication; contact; content; device; example; group; improve; knowledge; net; relationship; report; sending; short; social; technology; test; traditional; understanding,access; account; adulthood; advent; authoritative; developing; distributed; extent; fundamentally; future; however; important; known; previous; rapidly; research; resistance; result; shaping; shared; study; theory; typical,communicate; sharing; use,communication; contact; content; example; improve; net; relationship; technology; traditional
wnl spain robin hood,human_reference,human::elementary,,1.3035859580044398,-71.55874999999997,0.2888888888888914,9.85735607675906,-3.0572429717675256,-16.257596291530177,-0.03829096380771363,capitalist; economic; general; growth; movement; network; production; social; supported; system,advance; capacity; communication; element; focus; generate; include; independent; insight; intention; ironically; needed; population; reciprocity; recognize; reliance; suggested; table; widely,improve; support,economic; general; growth; production
wnl spain wetlands,human_reference,human::elementary,,0.21053248243830597,-20.22222222222223,-5.7369694191938265,-2.3124502608541775,-2.2896437495835436,-32.47421853559118,-0.01003384912959382,adult; collected; environmental; history; impact; importance; important; modern; natural; process; protection; region; shape; society; state; technology; view; waste; western,both; creation; demand; erode; example; explanation; further; general; hemisphere; heritage; highly; however; include; increasing; indeed; innovation; migrate; needed; provide; status; stipulate; striking; support; table,effect; need; use; vital,adult; collected; environmental; history; impact; natural; process; protection; region; shape; technology; view; western
wnl star wars,human_reference,human::elementary,,-0.2390953506825907,4.884309133489467,-7.051720117854018,-4.101415094339643,-6.581158913901138,-15.071193197557761,-0.03880852323659301,available; directed; existing; information; interest; international; quality; successful,acquired; acquisition; considerable; cue; element; emerging; ensure; expanded; feature; given; highly; known; level; material; monitor; outline; participation; plethora; product; role; sequential; shared; state; whole,,available; existing; information; international; quality
wnl still no flying cars,human_reference,human::elementary,,-0.1492088366262887,-12.674468085106412,-12.102910238429217,-12.288362135744592,-3.741371985356281,-30.798712314086913,-0.03311682945774869,advanced; change; changing; climate; commonplace; communicate; communication; concern; connected; control; economic; electronically; encourage; environment; environmental; expanding; future; growth; important; improve; infrastructure; low; need; population; predict; present; reduce; sharing; study; system; technology; testing; transport,access; arguably; center; claim; competitive; component; connection; currently; data; demographic; detect; develop; developed; dynamic; enable; error; expert; focus; focused; fundamentally; given; global; however; human; imagined; impact; increase; increased; increasingly; innovation; instance; institute; integral; network; numerous; partial; policy; potential; previous; problematic; progress; quality; reduced; residential; robust; role; sector; shape; shared; social; sustainability; sustainable; technological; trend; university; urban; use; useful; virtual; working,developing; effect; example; improving; known,advanced; changing; climate; commonplace; communicate; concern; connected; control; electronically; encourage; environment; expanding; growth; important; low; need; predict; present; sharing; system; testing
wnl swarthy caveman,human_reference,human::elementary,,0.8459322589647997,-42.45923076923077,4.493485984998017,6.624363913064201,-2.5417525328245,-37.719559302119166,-0.0419649885669303,discovery; european; farming; group; institute; invention; modern; particular; related; science; study; suggest; system,agricultural; compare; complex; contact; culture; difficulty; environment; evolved; finding; focused; further; given; history; human; impact; initially; likely; ongoing; particularly; produce; reconstruct; reconstruction; result; revolution; robust; role; scientific; shaping; shift; striking; tend; transformed; transition; university; various,change; developed; exist; important,discovery; group; institute; invention; particular; science; study; suggest
wnl switched babies,human_reference,human::elementary,,1.1539601205523842,-65.00807102502023,2.340330927910202,4.9506323121660785,-1.8259143481728266,-33.61627687979747,-0.04357637474541752,biological; both; important; joint; maintenance; test; university,african; aspect; client; continued; culture; currently; customary; dilemma; error; ethnicity; factor; gain; given; guiding; inadvertent; increasingly; occur; principle; process; profound; rectify; relationship; report; represent; significant; term; thorough; tradition; traumatic; within,,joint; maintenance; test; university
wnl ten ideas,human_reference,human::elementary,,0.08846834481237131,8.801026957638044,6.898844560715077,8.941196817710136,-2.409118286358595,-92.05908580675123,-0.042751070918610176,above; experiment; ground; project; similar; solution; sustainable; system; technology,act; change; climate; concept; conventional; convert; cycle; disperse; facility; harvesting; increasingly; industrial; innovation; international; movement; provide; scale; type; urban,group; need,experiment; project; similar; solution; sustainable
wnl the greek island,human_reference,human::elementary,,-0.22785424592367695,12.888034898213505,-0.8840389736391217,-0.5216165413533531,-4.140408980289031,-44.22774197170031,-0.011930501930501929,card; cultural; economic; economically; explore; greek; modern,agriculture; consumption; contained; data; future; given; improved; improving; largely; network; numerous; particularly; petroleum; process; reduce; relative; scale; therefore; whole; within; word,change; effect; example; increase; reduced,card; cultural; economic; economically; explore; modern
wnl the age of music,human_reference,human::elementary,,0.6143735307951405,-21.806501547987637,7.738236396094578,10.350574184657773,-1.9009451623485774,-20.18926826215396,-0.012618657937806872,adaptation; combination; common; lack; literature; western,access; act; aid; circuit; concept; growth; heritage; planning; production; sound; status; successful; whole,group; working,adaptation; combination; common; lack; literature; western
wnl the last,human_reference,human::elementary,,0.524946422542343,-21.654351395730714,6.63949421576541,5.545491564863312,-3.136866926587903,-48.86108054868399,-0.007408364560451394,african; both; control; european; female; human; image; learned; male; successfully; traditional,asian; climate; demand; natural; sustained; unique,use,control; european; learned; traditional
wnl the lightweight,human_reference,human::elementary,,0.21804347219935077,-11.86058823529413,1.2438474159146722,0.6339288440983069,-2.958027947727306,-2.4270513701836762,-0.042448747960558975,above; approximately; completed; degree; device; difference; environment; experience; express; greek; invention; limited; motor; natural; needed; planning; project; similar; test; tested; testing; typical,accelerated; capacity; design; develop; display; effectively; enable; extension; functioning; further; however; improvement; individual; industrial; initial; international; likely; limiting; low; need; observe; product; required; result; scope; system; unit; university; user; weight; whole,combination,above; approximately; completed; degree; difference; experience; greek; test; tested; typical
wnl the millenials,human_reference,human::elementary,,0.18638682352741012,-0.5303030303030027,7.310872059667247,5.027930138568138,-1.9046319190377439,-8.262471016085911,-0.008898983058972992,account; change; contact; effect; future; information; networking; organize; relationship; social; status; unique; use,active; activity; analysis; both; contrast; currently; data; need; percentage; positive; presence; provide; rely; report; shared; technology; trend; unavoidable,example,effect; future; information; networking; organize; status; unique
wnl tributes,human_reference,human::elementary,,0.1970285133002081,-3.599128540305003,3.467614361217443,6.060772134940976,-3.903445218042144,-21.10062161861626,-0.015467500868960718,african; bottleneck; change; developed; future; history; international; label; lack; modern; pattern; received; sound; technique; traditional; various; working,acquired; act; agricultural; arguably; barrier; both; circuit; cite; couple; cultural; diminished; discipline; establish; established; further; however; innovative; largely; limited; mainstream; matching; rearrangement; rooted; similarly; unsatisfactory; within,known; reduced; result; successful,african; bottleneck; change; developed; future; history; international; lack; modern; pattern; received; technique; traditional; various; working
wnl use of e cig,human_reference,human::elementary,,0.4213117543518521,-22.386199008768585,-0.07299467044458652,4.1460268317853775,-2.906600568467379,-18.034676290164242,-0.010585905322747446,change; contain; continuing; current; data; directive; effective; electronic; european; experience; group; growth; improving; increase; limit; mean; method; period; produce; product; published; short; statistics; study; suggest; suggested; technology; term; traditional; use,aid; commonplace; comprise; continued; decline; distinction; evidence; however; impact; increasing; innovation; interpretation; obtain; policy; proportion; quarterly; research; reveal; subject; tendency; usage; useful; user,collected; effect; important; increased; percentage; support,change; contain; continuing; current; directive; effective; european; experience; group; growth; improving; limit; mean; method; period; produce; product; short; statistics; term; traditional
wnl vienna,human_reference,human::elementary,,-0.12335736737827041,-3.9926739926739856,-7.176080710461008,-5.816888374783105,-3.576298708949821,-27.679092780960687,-0.03547570850202429,central; environment; german; international; quality; social; study; transport,african; assess; both; century; climate; consistently; dominate; economic; equivalent; european; factor; highlight; highly; however; impact; important; increase; largely; level; locate; municipality; overall; perform; published; recreational; regional; relatively; research; stable; survey; table; tend; tradition; uniquely; vulnerability; within; working,above; similar; use,international
wnl waiters,human_reference,human::elementary,,0.2977105786081347,-15.185030395136778,-0.008179005146814688,3.574758220502872,-1.7590331320178443,-18.431809190500616,-0.01178999623252,basic; both; card; change; collected; introduction; low; minimum; note; process; rely; shared; shift; system; voluntary,account; culture; distribute; equally; evidence; experience; given; however; impact; improve; ironically; needed; policy; procedure; provide; regardless; requirement; review; state; table; therefore,difference; need; report,basic; collected; introduction; low; minimum; note; voluntary
wnl ways facebook changed,human_reference,human::elementary,,0.5217582094379564,-37.6841330585811,-3.2411452902329074,-2.6667851725445075,-1.9127535072762036,-26.74281731246154,-0.026406590325850215,account; author; available; changing; colleague; connected; contact; data; describe; effect; forum; group; information; mean; need; network; organize; organizing; research; social; tool; traditional; understanding; university; word,access; article; association; center; change; cultivate; direct; directory; effectively; emergence; employment; encounter; engage; everyday; further; given; hierarchy; image; independence; indirect; journal; overall; phenomenon; philosophy; product; project; redundant; reported; representative; resource; restrict; revolution; sector; shared; sharing; society; source; transformed; traumatic; useful; user; weight; within,common; importance; important; limit; meaning; needed,account; author; available; changing; colleague; contact; data; describe; effect; forum; group; mean; organize; organizing; traditional; understanding; word
wnl we must,human_reference,human::elementary,,0.327488952827466,-24.81959706959708,-6.119398503187654,0.9325703102667262,-4.361455717653989,-13.617379156599014,-0.04181914611508883,agriculture; change; climate; developed; developing; environmental; global; impact; low; natural; need; organization; percentage; produce; production; provide; reduce; reduced; waste; weight,agricultural; analysis; available; both; commonly; concerted; consumption; continuing; demand; distribute; distribution; enabling; equivalent; existent; future; gain; globally; household; increased; industrialized; infrastructure; interest; known; largely; management; meaning; net; participation; population; progress; purchased; report; require; subject; subsequently; suggest; total; underdeveloped; whole,effect; improved; successful; use,change; climate; developed; environmental; low; natural; need; organization; provide; reduce; reduced
wnl wealth therapy,human_reference,human::elementary,,-0.14476745569682525,0.8583333333333485,-2.2418153905200597,-6.677173627528191,-1.6147785410533224,-19.655015847885295,-0.04792821202494956,central; common; expert; group; important; international; isolating; isolation; judgment; need; negative; result; value; wealth,acceptable; argue; barrier; center; document; expanded; experience; global; globally; increase; increased; inequality; ironically; isolated; movement; net; phenomenon; positive; primary; refer; research; resulting; socially; study; tend; unique; weight; working,,common; international; isolating; isolation; judgment; need; result; value
wnl what does apple,human_reference,human::elementary,,0.3988873719125219,-0.4109522063317286,12.241143832693126,14.769599303135863,-1.8989237130236027,-18.76785941810084,-0.02461538461538461,access; coexist; example; exclusively; experience; global; history; international; mainstream; ownership; revolution; table; total,active; adapt; benevolent; compare; content; context; contrast; crucial; debatable; decline; future; generally; generate; given; globally; growth; however; information; limit; measure; mp; previously; progressively; research; scale; suggested; transition; working,comparison; important; support; use,access; coexist; experience; global; history; international; ownership; revolution; table; total
wnl what is world s,human_reference,human::elementary,,-0.5608700256934909,5.703418803418799,-17.057511649348385,-15.363580110497196,-5.280112406291963,-34.64987593500038,-0.017413685628682313,above; approximately; global; increasing; level; low; male; natural; nature; particularly; population; predict; rate; report; state; support; term; total; use; whole,abandonment; century; change; climate; consumption; decline; disintegration; effective; environmental; example; expansion; exploit; exploitation; farming; gradual; highly; human; identify; impact; industrial; likely; likewise; municipality; render; result; similarly; succession; system; thereby; threefold; urban,difference; existing; future; reduced,approximately; global; low; predict; rate; report; support; use; whole
wnl what s the secret,human_reference,human::elementary,,0.4758449503703467,-25.975677339901438,-1.2796332855558603,5.067547654133193,-3.3669166663115284,-20.61567847853658,-0.027681527681527686,important; particular; particularly; rate; short; university; useful; volume,anatomical; ancestry; characteristic; compare; development; distribution; evidence; evolution; general; human; hypothesis; importantly; linked; low; notion; phase; precisely; prior; prompting; reduction; require; state; suggested; tend; tendency; unique; voluntary,achieve; change; given,important; particular; particularly; short; university; volume
wnl who can stop trump,human_reference,human::elementary,,0.2500293781642082,-0.528846153846132,6.757987543476531,9.830840455840416,-2.6867021061839687,-40.218173674839235,-0.023706004140786753,both; current; explanation; general; mean; policy; sound; support,actively; arguably; base; confound; constituency; conventional; core; evidence; following; identify; increasingly; need; nonetheless; organizing; overarching; particular; particularly; percentage; prominent; scenario; source; status; suggest; typical; unrealistic; view,change; chosen; important; reduced; supported,both; current; explanation; general; mean; sound
wnl who invented,human_reference,human::elementary,,0.8445401188890787,-23.28310502283108,15.015896307165576,17.327835783791443,-2.6780282573616887,-8.059939795450134,-0.029716004531427018,century; change; coded; develop; developing; failure; invention; patent; received; recognize; section; solution; use,accepted; basis; card; concept; demand; design; development; device; devise; difference; enable; etc; external; form; growth; history; however; identification; important; merit; model; proposed; recognized; revolution; role; stated; successfully; system; technology; whole; widely; working,group; similar,century; change; coded; develop; developing; failure; recognize; section
wnl why are people so wrong,human_reference,human::elementary,,0.5701646605514676,-26.030660377358515,5.043949814828807,5.3573171546997855,-2.095244908350306,-22.276915995297102,-0.02521966477245595,access; actual; developing; example; important; international; overestimate; perspective; population; proportion; rural; study; survey; varied; variety; wealth; whole,accurate; available; basic; both; calculation; census; concern; connected; educated; effect; emotional; expected; explanation; generally; group; information; interpret; likely; mental; range; representative; scale; sending; social; tend,,actual; developing; international; perspective; proportion; varied; variety
wnl why we should,human_reference,human::elementary,,0.3964796444773022,-13.537373737373741,6.717675635276578,5.626206024857822,-4.423147617719515,-58.43841941125079,-0.026791898706120296,effect; environment; environmental; human; importance; improve; need; period; process; produce; reduce; reduced; use; valuable; vital; whole,adjustment; argue; challenge; equilibrium; examine; frequent; functioning; however; initial; intensity; known; likely; natural; necessary; production; reduction; relatively; short; suggest; tend; typically,change; example; experiment; working,environment; environmental; human; importance; improve; need; period; process; produce; reduced; valuable
wnl why you should start work at 10,human_reference,human::elementary,,-0.05728597152758497,6.668164313222121,1.4874213836478134,1.9612040133779374,-1.2754056695992162,-13.299015576758293,-0.015974539995285184,above; cycle; depression; improve; linked; natural; particular; particularly; performance; positive; report; science; solution; university; working,associate; biological; contain; control; conventional; deprivation; deprived; equivalent; ingrained; institute; published; research; system; traditional,lack; mean,above; cycle; depression; linked; particular; particularly; report; science; university
wnl will drones,human_reference,human::elementary,,0.3624751628666506,-34.81111111111113,-6.479627338797002,-7.193886442854534,-4.00007007187315,-26.620811039688476,-0.03530861431611963,contact; failure; ground; map; need; planning; short; solution; task; technology; typical; use; working,autonomously; base; benchmark; component; concern; contingency; critical; demonstrate; detect; developed; development; device; elaborate; established; exchange; exploration; focus; furthermore; global; imagery; information; infrastructure; inherently; institute; interest; invention; likely; low; merely; needed; partially; particular; perform; policy; population; progress; proposed; rate; relatively; report; result; standard; state; status; technical; technologically; thus; university; urban; viability,basic; example; expert,ground; map; solution; task; typical
