story_key,comparison_type,variant,semantic_similarity_sbert,delta_cli,delta_aoa,delta_concreteness,delta_imageability,delta_fk_grade,delta_mtld,delta_tier2_proxy_token_ratio,tier2_types_retained,tier2_types_removed,tier2_types_added,low_frequency_tier2_types_retained
amazon,human_reference,human::elementary,,-0.06289022610753392,-9.743628185907028,-10.74290064712602,-4.601316701316705,-2.3344923148013024,-20.25157422927292,-0.0029036004645760782,address; advisory; agriculture; application; applied; cooperation; cultural; currently; domain; environmental; generic; governmental; important; interest; known; level; meaning; protection; region; science; technology; use; view; word,argue; author; existing; expansion; expected; fore; governance; group; label; novel; organization; primary; promotion; proposed; province; purpose; received; reinforce; relevant; role; strategy; within,discuss; discussion; support,advisory; agriculture; cooperation; cultural; currently; environmental; meaning; protection; science; technology; view; word
amsterdam,human_reference,human::elementary,,0.4445357807331618,-21.478978978979,5.342995169082087,1.5589080459770344,-2.7606732402708936,-42.173335817841306,-0.025138260432378077,century; industrial; learned; planning; social; whole,access; accurate; basic; ensure; nature; policy; rapidly; society; tolerance,maximum; use,century; industrial; learned; planning; social; whole
anita,human_reference,human::elementary,,0.40456159443418854,-7.199999999999989,9.172724730882123,10.706168831168782,-2.340560086853074,-25.183789954337897,-0.05215898280702568,african; asian; bridge; census; change; class; cultural; discussion; image; important; inequality; link; natural; need; population,ancestry; apparent; attitude; complex; contrast; cycle; define; defined; demographic; discrimination; diversity; equality; explicit; goal; however; largely; latent; lecturer; likely; mainstream; minority; periphery; predominantly; prejudice; profoundly; project; publication; racial; relatively; result; social; society; sound; statistics; successful; suggestive; support; university,difference,asian; bridge; census; class; cultural; discussion; important; inequality; link; natural
arctic mapping,human_reference,human::elementary,,0.32442063038629554,-17.909090909090935,2.736447430089015,-0.17962962962963047,-4.054289861319148,-49.54225452834777,-0.011157946937763452,address; application; difficulty; display; expert; however; information; isolated; known; map; mapping; novelty; planning; project; territory; understanding; use; view,accessible; accurate; accurately; affect; chosen; cultural; data; ensure; existing; exploration; founding; growth; inhospitable; initial; largely; modern; needed; passage; provide; rapid; rely; result; selected; significant; situate; test; tool; transport; weighing,correctly; future; given; important; mean; short; whole,address; application; difficulty; display; expert; information; isolated; novelty; understanding; use
banksy,human_reference,human::elementary,,0.7621826909903279,-31.6653895274585,10.03474903474904,7.4342105263157805,-4.1718221007404495,-39.403841942601346,-0.03437209302325581,expected; impact,catalogue; clarify; commentary; conclusion; continued; control; critical; important; inclusion; interest; known; maintain; modern; potential; preservation; previously; proposed; separate; social; supported,received,expected; impact
billionaires,human_reference,human::elementary,,0.7434265606507711,-42.13464235624127,2.7735387463633856,1.7154088050314158,-2.53433355044724,-8.502931923113408,-0.06987202704334178,additional; aid; benefit; century; global; group; increased; inequality; poverty; report; similar; source; unequal; wealth,above; accelerating; accumulation; both; corrosive; creation; destructive; economic; economically; formally; forum; growth; history; improve; increasing; inefficient; inevitably; international; level; limit; low; monetary; need; net; network; process; published; rapidly; scale; significantly; socially; total; use; yield,information; reduce; reduced,additional; benefit; century; group; increased; similar; source
blackberry,human_reference,human::elementary,,-0.0540861215629064,-8.994425863991069,-8.061846689895447,-5.738003735086693,-1.4751117019368394,-53.14194252686636,-0.00952054399446263,absent; application; complex; connection; independent; isolated; limit; low; network; networking; revolution; sharing; social; technology; use; visual,account; analysis; attempt; available; belief; communicating; demand; deprivation; device; economic; effective; environment; following; initial; interest; mainly; multifaceted; notion; research; response; retain; source; system; term,alternative; period,absent; application; complex; connection; independent; isolated; limit; low; network; revolution; technology; visual
bolivia,human_reference,human::elementary,,0.1938979173473636,-23.946570972886718,-2.363559730250529,-10.658938420763604,-4.016584732655765,-1.5419695377128448,-0.026462063086104007,change; control; cultural; evidence; global; history; human; importance; important; international; model; natural; policy; production; region; report; state; support; transform; use,absolute; apply; appropriate; arbitrary; attain; broad; crucially; detrimental; developing; external; formally; framework; gain; given; however; implementation; increase; inquiry; integrity; numerous; pernicious; population; present; principal; provide; racial; rational; response; select; submission; sufficient; therefore; within,disagreement; effect; example; heritage; importantly; received; result; significant,change; evidence; history; human; importance; model; natural; region; transform; use
bonus pay,human_reference,human::elementary,,0.15384025258208367,-21.11518708730739,-6.431094257854795,-6.43230625583567,-3.5522625101794603,-21.402442457557754,-0.04494455316373125,act; culture; difference; equal; equality; example; female; flexibility; given; improve; institute; international; male; management; performance; promote; received; report; scheme; transparency; working,approach; both; changing; combined; contention; data; decreasing; direct; disparity; emphasis; evidence; existence; flexible; however; identical; individual; inequitable; level; mainstream; method; nature; overall; provide; research; reveal; shared; skewed; support; total,important,culture; difference; example; flexibility; international; promote; transparency
brazil,human_reference,human::elementary,,0.20176097363358092,-27.09119047619049,-8.14454325867365,-8.05936462778567,-2.621922335856752,-23.83842858915949,-0.038716840290081024,both; changing; demand; demonstrate; dispersed; experience; experienced; inequality; international; low; natural; need; quality; response; revolution; state; transport,assembly; challenge; disproportionately; evident; express; following; geographic; global; group; however; importance; initial; largely; level; link; marked; persistently; previous; rapid; regional; shape; similarly; social; sound; suggested; tend; test; varied; widely; widespread,given; improved,both; changing; demand; demonstrate; dispersed; experience; inequality; international; low; natural; need; quality; response; transport
cigarettes,human_reference,human::elementary,,-0.3016122382548907,-18.591331269349837,-24.574442435201945,-17.124844204403814,-4.261790794979081,-27.6417318259856,-0.06656880421011598,adult; electronic; european; harmful; important; introduction; need; reduce,advance; array; association; basis; benefit; broadly; clarify; compulsory; demand; directive; effective; evidence; expanding; following; further; group; however; increase; increasingly; inform; instance; manufacture; needed; organization; present; process; promotion; proportionate; proposed; support; table; targeting; trend; use; useful; voluntary,example; necessary,adult; electronic; harmful; introduction; reduce
coal to challenge oil,human_reference,human::elementary,,0.3618094244193468,-16.83704453441294,2.825090861889919,3.4102631578947467,-4.177959828649637,-22.653979599121456,-0.04230243773970009,change; climate; demand; efficient; experience; increase; inefficient; international; note; produce; production; reduce; report; research; source; term; use; within,abundant; accessible; allocation; allowance; combined; consumption; conventional; current; decline; economics; encourage; equivalent; flexible; global; globally; growth; incentive; increased; increasing; intensive; likelihood; likely; marked; mean; needed; particularly; permit; potentially; result; scheme; seek,available; extract; reduced,efficient; experience; inefficient; international; note; produce; production; report; research; source; term; within
copyright,human_reference,human::elementary,,0.6497028506722058,-33.911764705882376,5.0331610942249085,2.1795463805513577,-2.287435221783049,-14.111369843868118,-0.0320660252994138,achieve; article; author; creative; creatively; dialogue; existing; group; index; influence; level; mp; need; poverty; society; subject; technology,acquired; analogue; approach; collected; content; critical; data; default; distribute; emerge; established; form; highly; independent; intellectual; principle; robust; scale; science; technical,change; discuss; organization; strongly; support,achieve; author; creatively; dialogue; existing; group; influence; level; poverty; society; subject; technology
crowdfunding,human_reference,human::elementary,,1.0616472908159806,-62.36703741152684,2.604089856812095,1.3559890994673651,-2.5814081912537326,-1.5161875115926335,-0.011122312920745385,activity; alternative; change; example; experience; finding; ground; international; project; successful; test; use; within,access; card; commercially; complex; conventional; efficient; expansion; focused; generate; growth; innovative; invention; known; limited; production; rejected; testing; transaction; validate; vital; weight; whole,european; group; important; increased; present; produce,activity; alternative; change; experience; finding; ground; international; successful
denmark,human_reference,human::elementary,,0.05483203662554026,-6.600979192166449,-1.8087235505309422,-1.7490268223751286,-1.5711929132089253,-30.037865956679155,-0.008288654554694446,active; current; goal; population; profile; rate; relationship; response,farming; low; maintain; potential; previous; prioritize; report; specify; taboo,given; planning; positive; subject,active; current; goal; population; rate; relationship; response
everest,human_reference,human::elementary,,-0.023613554393886904,-10.30735930735932,-5.95479808639368,-7.107513332942631,-1.6830695912274862,-29.836489951864593,-0.014395640112776553,agriculture; base; both; change; changing; climate; combination; completed; continued; erosion; fixed; human; need; planning; previous; provide; region; waste,address; challenge; class; condition; degradation; demand; environmental; exponential; finding; flow; following; further; harvesting; identify; impact; include; increased; infrastructure; language; level; modern; network; numerous; potential; rapid; sector; sequence; western,effect; future; group; increase; study; trained; use,agriculture; both; changing; combination; completed; continued; erosion; need; planning; previous; provide
exercise,human_reference,human::elementary,,0.12192424782895872,-18.082341269841265,-5.803694189602481,-5.887705646954203,-3.0311282376060547,-15.001965705362068,-0.0394743596324624,benefit; capacity; change; correctly; educated; effect; effective; experiment; forum; group; improved; increased; maximum; need; short; system; testing; trained; university,acquisition; aim; attempt; consumption; control; effectively; extensive; finding; following; history; indicator; instance; intensity; level; measured; method; moderate; moderately; monitoring; network; overall; publish; published; range; reduce; research; significant; stationary; therefore; unattainable; undertake; universal; volume,activity; basis; example; increase; intensive; tested; use,benefit; change; educated; experiment; forum; improved; increased; maximum; short; system; testing; university
facebook deserted by millions of users,human_reference,human::elementary,,-0.20419891662703804,3.7941176470588402,-9.75508673230189,-0.37559085625730404,-1.8505244884888938,-24.18901908948557,-0.045224518888096935,alternative; analysis; directly; european; global; growth; information; network; population; sharing; similar; social; total,acquired; authoritative; base; compensate; data; declining; developed; expansion; factor; fraction; further; increasing; independent; particularly; performance; rapidly; rate; relatively; research; significant; source; substitute; suggest; sustained; switching; usage; user,increase; increased; initiative; use,european; global; information; population; sharing; similar
false memory,human_reference,human::elementary,,0.5993416288941988,-36.89999999999998,-1.780055636187683,2.0128510817349934,-4.1951688301563195,-19.382507468113715,-0.05221097113124969,associate; association; change; complex; evidence; experience; experiment; explore; form; future; human; identical; important; individual; information; institute; involve; known; research; researcher; similar; study; technology; understanding; university,activate; activity; actual; apparent; assumed; basis; both; colleague; construct; contain; control; distinguish; documented; elaborate; encode; environment; equivalent; ethical; example; express; formation; further; given; imply; independent; integrated; internal; learned; level; modified; multiple; need; neural; neuroscientist; occur; ongoing; perspective; phenomenon; philosophy; potential; process; reactivate; realm; recognized; related; relevant; rely; response; ritualized; science; specific; technique; typical; unit; whereby; within,changing; difference; however; received; use,change; experience; explore; form; future; human; identical; information; institute; involve; research; researcher
ferguson,human_reference,human::elementary,,0.044400479019730044,-5.423913043478251,-3.9454119026678427,0.8484506340851681,-2.4422776591779822,-0.05298465858909651,-0.008803330319909014,both; condition; continued; experience; future; general; given; history; important; level; organization; planning; present; quality; successful; support; vision; working,changing; class; conduct; contribution; emotional; ensure; essential; express; figure; global; joint; nature; numerous; particular; privileged; professional; shape; stability; stated; structure; successor; term; view; within,professionalism,condition; continued; experience; given; history; organization; planning; present; successful; vision
fitness,human_reference,human::elementary,,0.2754605658911806,-23.88930481283427,-5.658747958628226,-1.9934117599580645,-1.8346342506735809,-34.044636150813545,-0.010906371691404702,class; discuss; formal; general; group; need; weight,attitude; diminishing; directly; gain; given; known; largely; locally; motor; particularly; previous; university; use,practical,discuss; formal; general
food shortages,human_reference,human::elementary,,0.35823036343612324,-27.87780898876406,-4.656665103922478,-1.698382406397684,-4.9793548742346125,-5.729712972257005,-0.08598767500872051,developing; future; global; governmental; increase; increased; increasing; institute; international; limited; need; population; produce; production; report; total; waste,additional; address; agriculture; allocate; available; century; climate; common; considerable; current; currently; demand; depend; derive; develop; essential; expected; general; generate; household; impact; include; increasingly; insecurity; intensify; limiting; locally; management; proportion; regional; relevant; reliable; rely; research; scale; scarcity; separate; system; technology; western,change; changing; discuss; farming; given; limit; percentage,governmental; increased; increasing; limited; produce; total
gangs,human_reference,human::elementary,,0.3378464146682164,-16.255977229601513,2.048798560389514,3.164208567614594,-1.2818470678934801,-5.362465299733017,-0.04137183575842137,control; effect; experience; group; particularly; primary; project; scheme; support; system; term; voluntary; working,act; approach; climate; commitment; criminality; critical; current; developed; diagram; distinct; dual; economic; engage; given; hierarchy; highly; index; individual; lack; likely; manipulation; model; needed; network; offence; overall; practice; prevalent; recruitment; related; report; territorial; within,,control; group; particularly; primary; project; support; voluntary
gorillas and oil,human_reference,human::elementary,,0.4768826615006656,-22.755699177438316,5.124942407241747,2.5571062740076513,-2.4894298333761427,-33.18064947835674,-0.05862605420453615,accepted; affect; central; conflict; developing; environmental; erosion; eruption; exploration; future; global; heritage; important; international; natural; project; report; role; successful; support; valuable; whole,active; benefit; boundary; catalyst; climate; current; decline; development; economic; exploit; explore; further; generating; however; human; infrastructure; known; population; potential; present; provide; region; required; significance; social; sustainable; targeted; total; transform; trend; undertake; unstable; value,importance,accepted; affect; central; developing; erosion; eruption; global; important; natural; project; successful; valuable; whole
greeks and drugs,human_reference,human::elementary,,0.2925826873158959,-19.680397727272748,-2.081891891891871,0.326714036986516,-3.6729335051625007,-49.21710531765966,-0.013342353302331925,central; depression; economic; given; greek; knowledge; need; poverty; state; understanding,assumed; available; both; demand; destructive; eminent; engage; frequently; further; ground; incentive; increasingly; known; linked; marginalized; population; potential; preference; promote; protection; readily; response; similarly; society; specialized; tailor; trained; variant; weight; widespread,european; increased; international; monetary; related,central; depression; given; knowledge; poverty; understanding
hillsborough,human_reference,human::elementary,,-0.10434128902502171,-6.273872511967738,-8.46720707442887,-5.785882531722507,-6.451113172541742,-27.164700703393528,-0.05383657438451958,association; control; emphasize; evidence; independent; inquiry; repeated; report; tested,above; alter; apply; both; central; changing; concerted; conjecture; crucial; culpability; established; failure; finding; further; general; given; ground; group; largely; marked; neglect; ordered; particular; procedure; profound; rationale; response; section; selected; subsequent; substantially; support; supported; sustained; thereby; unequivocal; unit; university; valid; verify,change; important; negative; published,association; control; emphasize; independent; repeated; tested
insects,human_reference,human::elementary,,0.7281833491973593,-21.660000000000025,13.285541439806423,12.903856011013033,-2.107401112017108,-45.75710506514915,-0.007713193478231503,agricultural; agriculture; basic; common; contain; farming; group; harvesting; human; increase; international; organization; population; project; published; quality; reduce; source; study; taboo; use; valuable; waste,appreciation; benefit; consumption; contribution; conversion; critical; develop; environmental; factor; feature; given; globally; livestock; mean; premise; produce; rate; successfully; suggested; table; western,developing; discussion; environment; important; include; increasing; need,agricultural; agriculture; basic; common; contain; group; harvesting; international; organization; population; project; published; quality; reduce; source; study; taboo; use; valuable; waste
japan,human_reference,human::elementary,,0.3453975916858607,-26.650271370420626,-2.7029594446474334,-3.0823839146338514,-1.21802109010439,-18.4964159668979,-0.012451307975969945,both; code; coded; communication; connected; culture; focused; image; information; isolated; philosophy; product; shared; sharing; social; technology; view; visual,challenge; conception; develop; developing; device; enlightenment; focus; forum; frontier; globally; micro; need; net; present; range; simplified; solution; vision,,both; coded; connected; culture; focused; image; isolated; philosophy; product; shared; social; visual
japan menu,human_reference,human::elementary,,0.5303894257695155,-18.02246835443043,10.85281427412815,5.8528973462485965,-3.2248040754237515,-6.496111544020977,-0.006099390060993901,contained; example; global; group; international; ordered; report; similar; type,agricultural; attempt; cultural; culture; detailed; effect; eventual; expected; factor; given; guide; heritage; household; important; imposed; intangible; intention; known; lack; limit; myriad; obtain; origin; preference; produce; response; stated; undermine,corrected; result; sound; total,contained; example; global; international; report; type
kashmir,human_reference,human::elementary,,0.07240615850021981,-13.960407239819006,-6.584873232424968,-4.012566875593166,-2.3167035360195882,-23.971651069538638,-0.01645705354221947,anxiety; appropriately; change; code; common; cultural; direct; group; independence; independent; mean; mental; need; region; reliable; state,advance; advisory; article; avail; basic; both; ethics; focused; generally; heritage; infrastructure; language; largely; marked; normality; obligation; population; received; result; short; source; stimulate,encourage; mainly; valid,anxiety; appropriately; code; cultural; direct; independent; mean; mental; reliable
kate and william,human_reference,human::elementary,,-0.15395566714351,5.918367346938794,-3.1054803944049354,-0.9973989595838475,-3.718177926049485,-61.169318692464,-0.025225573601443674,couple; future; maximum; published; within,assume; control; convey; disproportionate; following; further; highly; indicate; instance; internal; intrusive; legitimately; nature; necessary; ordered; ordering; outcome; partially; particularly; preliminary; publication; response; source,,maximum; within
kenya,human_reference,human::elementary,,-0.12707861613676663,-1.056818181818187,-2.8420618194591043,-6.9934599156118225,-4.41513026497098,-40.198705142532674,-0.03904033020896036,accepted; contact; evidence; extended; independence; inquiry; international; limit; period; result,account; archive; claim; colony; conflict; currently; describe; difficulty; documentation; documented; estimate; history; human; inherited; judgment; known; planning; potential; potentially; rejected; rely; significant; systematic; technical; understanding; undoubtedly; word,use; view,accepted; contact; extended; independence; inquiry; international; limit; period
liberia,human_reference,human::elementary,,0.9401312438039173,-31.083054626532885,17.35928950336239,13.086842105263145,-2.511706876899698,-15.525798269739184,-0.035840896199659675,central; collected; essential; farming; flow; growth; important; interest; knowledge; learned; need; particularly; positive; process; project; region; similar; society; solution; source; system; test; use; waste,access; agriculture; aspect; benefit; control; demographic; discrimination; distributed; emerging; enabling; environment; global; irrigate; lack; manual; model; monitor; needed; organization; potential; practice; predominantly; production; provide; quality; replicate; research; social; stable; strategic; support; survey; sustain; university; viable; widespread,common; mainly,central; collected; essential; flow; growth; important; knowledge; learned; need; particularly; process; similar; society; solution; system; test; use; waste
lie detector,human_reference,human::elementary,,0.9893969274331526,-50.77572663000791,4.135256944104242,7.600936905284698,-3.354527266264167,-43.49728088821459,-0.05624259055321862,basic; developed; include; measure; method; rate; reliable; research; technology; test; university; within,accurate; alternative; anxiety; ascertain; attempt; combined; confound; consensus; contrast; conventional; correctly; cultural; developing; device; experiment; extent; finding; further; however; improved; indicator; individual; information; invention; known; level; low; monitoring; movement; optimal; overall; participation; pragmatic; premise; provide; random; relatively; report; scientific; scientifically; significance; stress; subject; suggest; supported; total; unaffected; use; widely,monitor; whole,basic; include; measure; rate; technology; within
life expectancy,human_reference,human::elementary,,0.6637459416948281,-32.6413864104324,2.983782883782851,6.440369985222446,-3.0105836170347615,-5.704179797039103,-0.034243620195561056,adult; african; anxiety; central; change; database; depression; evidence; expectancy; fertility; general; global; increase; institute; mental; metrics; need; organization; population; progress; project; radical; reduced; result; study,absence; academic; assess; colleague; common; conventional; empirical; exception; expected; extent; figure; finding; focus; further; however; individual; information; instance; justification; likely; marginally; marked; mean; nonetheless; particularly; policy; prevailing; previously; publication; published; rapid; represent; respectively; shift; significant; statistics; stimulating; substantially; theme; undertaking,commonly; effect; example; important; increasing; reduction,anxiety; central; database; depression; fertility; general; institute; mental; metrics; organization; population; progress; radical; reduced
