story_key,comparison_type,variant,semantic_similarity_sbert,delta_cli,delta_aoa,delta_concreteness,delta_imageability,delta_fk_grade,delta_mtld,delta_tier2_proxy_token_ratio,tier2_types_retained,tier2_types_removed,tier2_types_added,low_frequency_tier2_types_retained
life on mars,human_reference,human::elementary,,0.4425475447156653,-31.53726708074538,1.55932816257166,-5.882065651268704,-2.5885637060898965,-14.025731327406731,-0.0190020769936724,adapt; basic; change; colony; element; firstly; human; include; need; present; primary; project; successful; support; system; total; understanding; whole,aim; anticipated; capacity; couple; developed; developing; development; directly; entry; equal; establish; existing; expected; feasible; formation; future; however; imperative; importance; instance; lecturer; map; nature; needed; nevertheless; perform; pioneering; related; reported; required; resilience; settlement; substantial; sum; technical; tested; theoretical; university; varied; vision; weight,achieve; example; improve; necessary; use,adapt; basic; change; element; firstly; present; primary; successful; total; understanding; whole
loterry,human_reference,human::elementary,,0.7120088911756279,-16.756034482758594,14.564556962025279,15.91535433070868,-1.37989379528263,-9.75630888119106,-0.023143523143523137,economics; employ; employed; existing; likely; proportion; range; study; supported; table; total; voluntary,analysis; anticipated; author; domestic; effect; further; generating; however; measurable; need; product; purchased; report; research; transform; use,given; important; preferred; working,economics; employ; existing; likely; proportion; range; supported; table; voluntary
malala,human_reference,human::elementary,,0.21584989137739508,-7.806249999999977,2.017576347258398,4.143757648197209,-2.224886381824021,-15.52558262206469,-0.014322712290064356,central; change; continued; equality; female; general; group; history; international; representative; society,articulate; following; global; influence; intention; interpretation; multiple; need; recognition; response; symbol; targeted; unstated; use,suggested,central; change; continued; equality; female; general; group; history; international; representative
meteorite,human_reference,human::elementary,,1.0537997839228663,-44.05896805896805,11.353243925372396,12.365376827896512,-4.117491134345663,-29.501656276907696,-0.02726122707147375,above; central; ground; impact; state; suggested; test; total; whole; within,capability; economic; expected; forum; however; informed; international; language; linked; origin; particularly; reported; result; subsequently; system; valued; visible; volume,connected,above; central; ground; state; test; total; whole; within
midlife crisis,human_reference,human::elementary,,0.1526802528339808,-6.814692982456165,1.9689733593242522,1.0176847741844313,-1.6304171838857329,0.30000672952958496,-0.013600044544669954,emotional; equivalent; evidence; experience; female; human; international; male; radical; research; separate; similar; study; understanding; university; various,common; concept; decline; evolved; future; journal; known; literature; myth; particularly; pattern; produce; published; related; response; result; social; specific; subjective; suggest; tendency,equal; increased; level,equivalent; female; human; international; male; research; separate; similar; various
murderers beware,human_reference,human::elementary,,0.5849348880386392,-34.55936856554564,2.0705693664795604,-0.0685476815397692,-3.3049028867334407,-11.610940603899707,-0.022759601706970112,analysis; analyze; assisted; european; evidence; examine; group; helpful; institute; mean; method; need; system; traditional; university; use; virtual,aim; combined; complement; conventional; development; discovery; efficiently; enable; gain; german; increasingly; initial; initially; internal; particularly; potential; project; rejected; resonance; science; selected; state; substantiate; technique; undermine,change,analyze; assisted; european; evidence; examine; helpful; mean; need; virtual
nsa 2,human_reference,human::elementary,,0.27506389329043657,-14.15853976531946,3.1568965517241736,0.16593006629403817,-5.247246719025387,-37.28563750408526,-0.04160868827422365,act; center; data; database; german; increase; independent; information; international; relationship; state; strongly; support; transparency,access; acquired; activity; address; alternatively; challenge; communication; concern; consistent; direct; domestic; exceed; expressed; extensive; focus; fundamental; global; incidental; increased; intentional; judgement; limit; need; period; policy; practice; present; probable; proposed; provide; query; report; response; retain; separately; sponsored; subject; suggested; total; traditional; transitory; transmission; understanding; vital,example; important,center; german; increase; independent; international; relationship; state; strongly; support
nsa scandal,human_reference,human::elementary,,0.06068424078679069,-16.817543859649106,-7.262690672668214,-7.252172392691648,-2.175420552283505,-9.066309623970099,-0.03952636510776045,access; act; collected; content; control; data; direct; directly; document; electronic; history; important; include; information; introduction; knowledge; networking; prism; section; sharing; similar; social; targeting; user; valuable; variety; within,acquired; acquisition; assistance; both; breadth; collectively; consent; contained; continuing; currently; dissemination; distribution; enable; ensure; example; extensive; extent; inability; individual; level; material; minimize; nature; obtain; organization; participating; participation; perform; presentation; previously; refer; review; scale; scheme; significant; specifically; subject; targeted,change; communicate; increase; safeguard; use,control; electronic; important; introduction; networking; section; sharing; similar; social; valuable; variety
nelson mandela,human_reference,human::elementary,,1.0252809774617775,-27.542194092827003,15.72724458204334,24.19018560894989,-1.2707678213605185,-3.691168091168109,-0.036218444100978874,african; current; history; racial; shared; state; transformed,achieve; act; address; change; class; commitment; comparable; continued; declining; equal; example; figure; given; global; human; ideal; inclusive; international; marked; minority; note; ordered; precisely; reconcile; reflection; seek; society; term; willingness,important; similar,racial; shared; transformed
nepal,human_reference,human::elementary,,0.5316099471515143,-32.4736842105263,-0.34100930916218886,0.8902292768959228,-1.8655461367946806,-18.97007997007998,-0.007972374446362882,adult; both; central; demand; increase; increased; international; management; population; protection; published; survey; traditional; use,census; century; conflict; data; effective; increasing; numerous; parallel; significant; systematic; unit,decreasing; similar,adult; both; central; increase; international; management; population; protection; published
norwegian sun,human_reference,human::elementary,,0.34706708910138717,-7.25468164794006,5.72268270944744,10.050735578784327,-1.2900581079584938,-19.58464165298841,-0.019366921494581073,above; century; change; concentrated; couple; cycle; further; german; known; maintenance; movement; needed; strongly; total; view,access; equally; expected; following; generate; however; imagined; improved; initially; intervening; largely; need; ongoing; project; reported; rural; symbol; technology; waste,reflect; similar,century; change; concentrated; cycle; further; german; known; maintenance; movement; needed; strongly; total; view
obama,human_reference,human::elementary,,0.10266066849818523,-19.91329225352115,-4.737400530503976,-10.175169906748863,-3.1647686547480696,-16.169917269202983,-0.03328328328328328,both; change; climate; common; continued; critical; economic; emotional; ground; need,address; african; challenge; code; destructive; disillusionment; effect; establish; existing; expressed; failure; given; guiding; historically; individual; initially; level; period; policy; rejected; reported; required; resolve; seek; state; successful; sum; term; threatened; transform; widespread,example; reduce,change; climate; common; emotional; ground
old age,human_reference,human::elementary,,-0.08235549728408553,-15.91402714932127,-12.83202151643394,-10.612213584288043,-2.4824630946877733,-37.25133979203355,-0.08854501409007762,above; basic; compulsory; developing; generally; history; however; importance; independence; international; low; mean; need; population; proportion; report; similar; support; system; term,account; address; adequately; advocacy; affluence; application; appropriate; basis; benefit; calculated; chosen; comprise; contribute; crucial; data; demographic; developed; development; disadvantage; domestic; emerging; employment; enabling; environment; equal; example; expectancy; expected; general; given; global; group; hence; human; increased; increasingly; index; inevitably; lack; likely; limited; pioneering; policy; poverty; product; progressive; psychological; quality; relatively; robust; scarce; shift; significantly; sufficient; suggest; survey; universal; value; vulnerability; weight; weighting,african; failure; historically; important; percentage; study; useful,above; compulsory; developing; generally; history; however; importance; independence; international; low; mean; need; report; support; term
organs,human_reference,human::elementary,,0.3080729018821779,-13.90494623655917,3.329976689976661,2.495206055508845,-1.4591234830488133,-4.796174664256185,-0.05181936322287199,apply; assembly; card; explicitly; importantly; increase; need; representative; scheme; strongly; use,act; adopt; aim; association; assumption; concern; consent; coordinating; crucial; enduring; expressed; factor; further; however; improve; improved; inevitably; interest; knowledge; lack; participate; policy; population; potential; presumed; process; progress; provide; rate; refusal; response; result; role; society; specifically; substantially; system; working,assume; example; important; organizing; relative,apply; assembly; card; explicitly; importantly; representative; strongly; use
pope,human_reference,human::elementary,,-0.22709761159804243,12.875286415711969,-1.625100026673806,0.21742505217082453,-3.2086083581179885,-20.2193735582443,-0.023911917410526062,absolute; both; chosen; completed; following; german; likely; modern; particularly; present; psychological; published; representative; state; whole; word,accordingly; account; act; address; adequately; characteristically; condition; emerging; extent; fulfil; global; govern; ground; importance; incapacity; insufficient; necessary; organization; recognize; role; task; traditionally; within,cardinal; future; needed; short,absolute; both; completed; following; likely; modern; psychological; representative; state; whole; word
prince harry,human_reference,human::elementary,,0.18684096367067118,-17.665582303188046,-2.025085190039306,-4.6525766375063995,-3.089478539093946,-27.010331217138862,-0.019393503299606214,known; province; role; socially; uniform,acceptable; association; commentary; difficulty; embedded; example; exchange; given; ground; monitoring; necessary; particularly; relationship; report; rooted; support; therefore; understanding,compare,known; province; role; socially; uniform
rats,human_reference,human::elementary,,-0.2614617322243542,-4.742657342657367,-11.705843783296473,-11.6204453299286,-2.4900197044335,-13.190143939303354,-0.04165296791643103,above; activity; author; change; combination; communicate; communicating; communication; connected; control; coordinating; correctly; difference; direct; directly; electronic; further; future; important; individual; information; interacting; net; network; research; separate; sharing; study; task; technology; test; theory; trained; university,achieve; act; collaborate; complex; cortex; distinguish; distributed; dominate; emergent; enable; encode; established; ethics; institute; journal; known; link; linkage; motor; movement; multiple; potential; predict; provide; published; radical; region; required; resulting; reveal; scientific; separated; signal; transmission; transmitted; workable; working,connection; linking; process; received,author; combination; communicate; communicating; coordinating; direct; directly; further; individual; interacting; net; network; research; separate; sharing; study; theory; trained
richard iii,human_reference,human::elementary,,0.6234061121732204,-25.18617886178862,6.149809160305324,8.802709847984147,-4.752337374969688,-28.86848919859878,-0.016848899476716958,descendant; evidence; expert; matching; society; technology; university; word; working,base; crucial; finding; further; history; human; identify; probable; project; range; research; ritual; unfolding; weighing,need; negative,matching; technology; word; working
royal baby,human_reference,human::elementary,,0.848802920276671,-26.053669222343956,15.018636546994742,14.611675824175848,-1.867768923435726,-7.862864330146991,-0.005102163993529744,above; both; couple; following; formal; future; important; indeed; occasion; present; tradition; unique; within,attribute; conqueror; equal; experienced; given; group; informed; initiative; interference; intrusion; status,,above; following; future; important; indeed; occasion; present; tradition; unique; within
skydiver,human_reference,human::elementary,,0.3737154810217529,-17.986657303370805,2.2292032836376734,3.530126883211608,-2.910735850295964,-8.925525181015132,-0.02822395746801794,above; barrier; control; history; human; landed; practice; sound,attempt; chosen; concern; cooperation; desired; existing; further; given; guiding; improving; known; marked; measured; planning; previous; previously; rapid; sponsored; support; survival; type; varying; visible; working,compare,history; human; landed; practice
spain,human_reference,human::elementary,,0.517785913086724,-37.26816239316241,-2.190549548215074,-3.4785505658999796,-5.7251641648276,-53.289405252938366,-0.038830706301350534,complex; economic; environmental; european; nature; needed; project; supported; traditional,above; access; actual; benefit; central; century; current; currently; equivalent; estimate; expertise; future; granting; group; impact; justify; lack; minimum; multimedia; network; overlap; preliminary; proposed; protection; reduce; region; role; strategic; study; survival; sustainable; threatened; typically; urban; view; vital,important; solution,economic; nature; needed; supported
starbucks,human_reference,human::elementary,,-0.2029718185212832,-11.85415282392023,-12.4244602134886,-14.709057712153708,-2.1055915361234483,-14.103698396209907,-0.005556064352657458,affect; chosen; complex; current; design; direct; economic; employment; focus; group; highlight; impact; important; indirect; level; multinational; need; various,account; activity; attempt; claim; contrary; cumulative; extended; however; image; international; link; management; mp; particular; prominence; recognize; social; subject; term; value; vital,changing; connection; encourage; example,affect; chosen; complex; current; design; direct; employment; focus; indirect; level; need; various
superbugs,human_reference,human::elementary,,0.5165540308368347,-27.348124999999982,7.51366971207085,-2.012120846650191,-2.206754978154766,-33.27115677288981,-0.05103898286098353,change; common; develop; discovery; expectancy; farming; intensive; international; organization; resistance; short; use; working,abstract; acquired; active; agriculture; assumed; century; commonplace; consequently; contrast; cultural; development; emerging; essential; evidence; evolution; evolve; global; highly; impact; incentive; increasingly; ineffective; initially; largely; livestock; low; manufacture; method; notable; notably; pattern; prevalent; previously; principally; production; proportion; rapidly; rate; recognition; rely; sound; state; survival; transformed; warrant; widespread; within,example; need,change; discovery; expectancy; farming; intensive; international; organization; short; working
swedish prisons,human_reference,human::elementary,,0.45217771019296304,-35.34270334928226,-4.294830695251449,-3.8099612337771873,-1.327933791698495,-21.116999335846145,-0.07869919457842217,available; change; compare; difference; electronic; european; experience; modern; rate; short; support,achieve; address; adult; aggression; apply; approach; assisted; both; broadly; combined; concept; decline; developing; effective; emphasis; enlightened; ensure; enterprise; example; exceed; expected; expressed; facilitate; fixed; focus; following; goal; however; impact; important; likely; low; maintain; minimize; need; needed; network; organization; overall; population; process; profile; progressive; proportion; provide; received; region; reintegrate; relatively; respectively; similar; social; society; strive; successfully; system; term,,available; compare; difference; electronic; european; experience; short
syria,human_reference,human::elementary,,-0.07146618801966603,-6.742000503905217,-4.726460743048449,-7.626686831084214,-3.126740434146061,-104.81023095961734,-0.01341463900362052,argue; central; lecturer; solution; sound; university; use; view,aspect; consolidated; continually; experienced; future; however; imposed; intended; intensified; international; marked; mosaic; novelty; predict; range; structure; visible; vital; within,increased; increasing,argue; central; lecturer; solution; use; view
teff,human_reference,human::elementary,,0.4995086236219429,-19.201331766549174,8.25459023734885,4.962029198871335,-3.206437079653856,-51.40430621901041,-0.021750521894201277,agricultural; aid; basic; change; class; cultural; export; goal; group; highly; important; increased; international; known; particularly; planning; produce; production; reduce; role; rural; tradition; type; urban; valuable,agriculture; benefit; central; consumption; cultivation; demand; developed; developing; displace; domestic; exclusively; figure; finding; global; ground; growth; improved; increasingly; institute; nature; organization; origin; primarily; profile; published; source; straightforward; strategy; substitute; suggest; tend; traditional; transformation; typically; value; western,mean; use,aid; basic; change; class; cultural; goal; group; highly; increased; international; particularly; planning; produce; role; tradition; type; urban
thatcher,human_reference,human::elementary,,0.1617747508874396,-7.018659711075429,0.5237499472847844,2.7771164021164054,-4.3563116954469905,-48.51235819075981,-0.02901298947568029,ally; both; change; economic; figure; greatly; industrial; policy; privatization; promote; result; short; state; unique; western; whole; within; word,century; challenge; chiefly; declining; description; domestic; dominant; emerging; energetically; european; following; global; ground; highly; history; known; learned; mainstream; moderate; modern; nominally; notably; obtain; phenomenon; recovered; shape; shared; significant; spectrum; successful; traumatic; use; view; widely; widespread,continued; control; important; particularly; support; supported,ally; both; change; economic; greatly; industrial; privatization; promote; result; short; western; whole; within; word
us shutdown,human_reference,human::elementary,,0.2625722283544678,-31.286931818181813,-8.461237645036533,-8.215388073119584,-4.3287952165363315,-24.97462421491943,-0.06039681672313241,international; monetary; stability; support; uncertainty,adopt; attempt; broad; comprehensive; conduct; contained; default; economic; encourage; essential; expressed; extend; focus; global; growth; however; initially; limit; manner; necessary; overall; policy; potential; promote; reduce; standard; stated; term; undermine,achieve; improve; solution,international; monetary; stability; support
violence,human_reference,human::elementary,,0.38146793677387036,-21.52380952380952,-0.8717504767640207,3.1584841014499148,-2.2351527630903725,-23.754972613749345,0.006964300731645778,complex; data; depression; domestic; educated; effect; experience; figure; global; likely; male; mental; need; organization; previous; recognize; related; report; research; transmitted,african; attitude; collected; comprehensive; extent; general; impact; increasing; learned; low; policy; profound; proportion; rate; recognition; region; reported; reproductive; social; society; study; sustain,acceptable; change; percentage; working,complex; depression; educated; figure; likely; male; mental; need; organization; previous; recognize; related; research; transmitted
wnl 101 year old bottle message,human_reference,human::elementary,,0.3986681304554538,-19.528919860627184,3.3569974554707187,2.4689069078434613,-1.9622861081071648,-0.9390920930445219,-0.026710912849526713,address; card; condition; culture; display; document; known; received; researcher,appreciation; attempt; author; available; given; group; incur; international; nature; note; science,,condition; culture; display; document; known; received; researcher
wnl a good night sleep,human_reference,human::elementary,,-0.16479900485029894,3.316627358490564,-2.7551810822839116,-4.875310865277413,-1.8704551751691234,-8.151023952785408,-0.02185529916680007,african; class; common; couple; data; efficiency; efficiently; finding; future; human; important; inefficient; irregular; likely; monitor; need; perform; performance; published; quality; range; report; research; revolution; status; study; symbol; waste; whole,approximately; compensate; currently; demand; demographic; deprivation; discrimination; figure; function; however; increase; input; level; low; modulate; monitoring; natural; negate; norm; numerous; output; planning; profile; promotion; rate; shift; short; stress; targeting; technology; transform; twofold; unsurprisingly,change; cycle; improve; reduce,african; common; couple; data; efficiency; efficiently; finding; future; inefficient; irregular; likely; monitor; published; range; status; study; symbol; waste
wnl apple,human_reference,human::elementary,,0.4132074166285359,-19.773813420621934,5.366328201768795,1.2775588900997263,-3.6189742174815116,-20.06679226732794,-0.0009209063108145676,accessibility; control; global; include; label; report; social; study; table; technology; valuable; value,account; advocacy; analysis; appropriate; both; domestic; experience; group; importance; improve; increase; increasing; increasingly; influence; innovation; interact; knowledge; performance; product; recognized; responsiveness; retain; significantly; symbol; traditionally; valued,increased; interaction; recognize; traditional,accessibility; control; include; label
wnl arctic ramadan,human_reference,human::elementary,,0.7901896198059698,-45.06076166024815,1.1103339493977842,3.265483584738206,-2.3966684537485463,-18.693318147551224,-0.009426607980235306,challenge; culture; currently; encourage; observe; particularly; population; use; within,adhere; change; completed; condition; element; focus; following; low; marked; reflect; reflection; shift; traditional; typically; unique,chosen; example; future; short; similar,challenge; culture; currently; encourage; observe; particularly; population; within
wnl are moocs the future,human_reference,human::elementary,,0.4537166793030687,-25.79163841807906,1.419062874407473,1.22311354594666,-3.776247609440947,-39.84365577262298,-0.006642847690882636,access; advanced; available; bridge; challenge; content; continuing; degree; develop; developed; developing; educated; entry; experience; future; global; individual; interact; interaction; interactive; international; knowledge; level; material; mean; model; need; professional; provide; quality; study; subject; support; technology; tool; university; use,academic; approach; benefit; central; concept; currently; data; define; design; dilemma; discussion; emerging; enable; gain; group; however; idealism; increasingly; innovation; interest; objective; population; presence; primarily; prospective; research; suggest; therefore; traditional; trend; type; working,aim; communicating; completed; encourage; essential; expert; finding; literature; mainly; present; reduced; whole,advanced; bridge; continuing; developed; educated; entry; experience; global; individual; interact; interaction; interactive; knowledge; material; mean; model; need; professional; provide; subject; tool
wnl bangladesh factory owners,human_reference,human::elementary,,0.7221374890607277,-37.92540792540791,4.485240726124744,3.220982142857167,-3.155560655015421,-10.02389791603946,-0.02020026702269692,accord; association; change; disruption; group; improve; international; needed; partial; policy; production; sharing; structural,complex; contribute; contribution; demand; ensure; expected; however; improvement; maintain; necessary; process; prompting; reduce; reported; significant; stress; threatened,given; improved; need; result; supported,association; change; group; partial; policy; sharing
wnl bangladeshi organization,human_reference,human::elementary,,0.9898586598047507,-65.11845930232556,-4.421590909090924,0.20679012345681258,-3.9250420289855086,-31.79174696231118,-0.07144633752020893,adapt; both; employed; map; organization; primary; working,aim; challenge; change; code; condition; conduct; context; cultural; development; domestic; elimination; ensure; environment; eradicate; flow; formal; global; however; important; increase; informal; limited; motivated; motivating; nongovernmental; policy; psychological; rate; recognize; role; sector; selected; sensitivity; social; society; sound; state; urban; vital,governmental; need,adapt; both; employed; map
