story_key,comparison_type,variant,semantic_similarity_sbert,delta_cli,delta_aoa,delta_concreteness,delta_imageability,delta_fk_grade,delta_mtld,delta_tier2_proxy_token_ratio,tier2_types_retained,tier2_types_removed,tier2_types_added,low_frequency_tier2_types_retained
crowdfunding,llm_simplification,openai::openai/gpt-5.2::few_shot::temp=0.0,0.840078592300415,1.156089430710617,-44.75637181409297,14.764525993883751,10.366043447293464,-4.640434473149053,22.529972743845775,-0.02346105179682443,activity; card; change; experience; focused; ground; international; production; rejected; successful; test; use,access; alternative; commercially; complex; conventional; efficient; example; expansion; finding; generate; growth; innovative; invention; known; limited; project; testing; transaction; validate; vital; weight; whole; within,common; expanding; goal; group; important; need; product; sending; support; useful,activity; card; change; experience; focused; ground; international; rejected; successful
crowdfunding,llm_simplification,openai::openai/gpt-5.2::few_shot::temp=0.2,0.8252476453781128,1.3015363408991405,-48.83772198407837,16.36020500622942,13.034685997436725,-4.480283266704735,10.020791435588876,-0.019380437274185973,activity; card; change; experience; focused; ground; growth; invention; production; project; rejected; successful; test; transaction,access; alternative; commercially; complex; conventional; efficient; example; expansion; finding; generate; innovative; international; known; limited; testing; use; validate; vital; weight; whole; within,goal; group; important; need; sending; support; useful; waste,activity; card; change; experience; focused; ground; invention; rejected; successful; transaction
crowdfunding,llm_simplification,openai::openai/gpt-5.2::few_shot::temp=0.5,0.8215599060058594,1.0798233441071752,-41.48913043478262,13.38326933786675,10.274272919434225,-4.09843117965557,12.710683662921724,-0.013122489147725735,activity; alternative; card; change; efficient; experience; focused; ground; growth; international; invention; production; project; rejected; successful; test; testing; transaction; use,access; commercially; complex; conventional; example; expansion; finding; generate; innovative; known; limited; validate; vital; weight; whole; within,developed; expanding; goal; group; important; need; produce; sending; support; useful,activity; alternative; card; change; efficient; experience; focused; ground; growth; international; invention; rejected; successful; testing; transaction
crowdfunding,llm_simplification,openai::openai/gpt-5.2::chain_of_thought::temp=0.0,0.8619060516357422,1.21700799044069,-51.12374581939798,13.947116227429433,9.403305177498737,-3.8714870194558095,12.48782302861568,-0.015546783983487689,activity; card; change; focused; ground; international; invention; project; rejected; test; use,access; alternative; commercially; complex; conventional; efficient; example; expansion; experience; finding; generate; growth; innovative; known; limited; production; successful; testing; transaction; validate; vital; weight; whole; within,common; expanding; goal; group; important; improved; interest; need; product; sending; support; useful,activity; card; change; focused; ground; international; rejected
crowdfunding,llm_simplification,openai::openai/gpt-5.2::chain_of_thought::temp=0.2,0.8215634822845459,1.0804351260301759,-39.37549407114625,15.952365298986933,9.562678062678117,-3.6079042927038394,6.622769440648796,-0.014631854486878308,activity; card; change; efficient; experience; focused; ground; international; invention; production; project; successful; test; testing; transaction,access; alternative; commercially; complex; conventional; example; expansion; finding; generate; growth; innovative; known; limited; rejected; use; validate; vital; weight; whole; within,base; common; expanding; group; important; need; sending; support; useful; value,activity; card; change; efficient; experience; focused; ground; international; successful; testing; transaction
crowdfunding,llm_simplification,openai::openai/gpt-5.2::chain_of_thought::temp=0.5,0.8428420424461365,1.0929507294007739,-44.783248081841464,13.37368467332999,8.514940506117,-3.50909766829659,8.300640751240309,-0.019464103779495805,activity; alternative; card; change; focused; ground; international; invention; production; project; rejected; test; testing; use,access; commercially; complex; conventional; efficient; example; expansion; experience; finding; generate; growth; innovative; known; limited; successful; transaction; validate; vital; weight; whole; within,expanding; goal; group; important; product; support; system; useful; value,activity; alternative; card; change; focused; ground; international; invention; rejected; testing
everest,llm_simplification,openai::openai/gpt-5.2::zero_shot::temp=0.0,0.9056907296180725,-0.047150413671478875,-15.463440668920157,-8.014614337126773,-6.456768540989685,-3.1305755403755384,-9.990888099657013,-0.041910763605243706,address; agriculture; base; change; changing; class; climate; condition; demand; erosion; fixed; further; human; language; level; need; region; waste; western,both; challenge; combination; completed; continued; degradation; environmental; exponential; finding; flow; following; harvesting; identify; impact; include; increased; infrastructure; modern; network; numerous; planning; potential; previous; provide; rapid; sector; sequence,environment; growth,agriculture; class; condition; demand; erosion; further; language; need; western
everest,llm_simplification,openai::openai/gpt-5.2::zero_shot::temp=0.2,0.9321296215057373,-0.1906107000435361,-8.429707792207807,-9.978537724493265,-6.545077804412301,-3.1072870510477735,-19.03037075304877,-0.04107818064056976,base; both; challenge; change; changing; climate; demand; erosion; finding; fixed; human; need; provide; region; waste; western,address; agriculture; class; combination; completed; condition; continued; degradation; environmental; exponential; flow; following; further; harvesting; identify; impact; include; increased; infrastructure; language; level; modern; network; numerous; planning; potential; previous; rapid; sector; sequence,conflict; entry; environment; farming; goal; skilled,both; challenge; demand; erosion; finding; need; provide; western
everest,llm_simplification,openai::openai/gpt-5.2::zero_shot::temp=0.5,0.9399514198303223,-0.07042828133164833,-17.41246095676479,-9.592741743882186,-7.607901002380913,-3.3274695802282004,-10.974059165796717,-0.03671388810707696,base; challenge; change; changing; climate; demand; environmental; erosion; fixed; further; human; increased; language; need; region; waste; western,address; agriculture; both; class; combination; completed; condition; continued; degradation; exponential; finding; flow; following; harvesting; identify; impact; include; infrastructure; level; modern; network; numerous; planning; potential; previous; provide; rapid; sector; sequence,effect; entry; farming; focus; skilled; total; trained,challenge; demand; environmental; erosion; further; increased; language; need; western
everest,llm_simplification,openai::openai/gpt-5.2::few_shot::temp=0.0,0.9321050643920898,0.12289211490509944,-11.763636363636408,-3.2638842792344462,0.2839697524775602,-2.488136356089239,-6.417313792851871,-0.030130919188094504,base; both; change; changing; climate; condition; demand; environmental; erosion; finding; fixed; human; level; need; network; previous; provide; region; waste; western,address; agriculture; challenge; class; combination; completed; continued; degradation; exponential; flow; following; further; harvesting; identify; impact; include; increased; infrastructure; language; modern; numerous; planning; potential; rapid; sector; sequence,compare; effect; example; farming; study,both; condition; demand; environmental; erosion; finding; network; previous; provide; western
everest,llm_simplification,openai::openai/gpt-5.2::few_shot::temp=0.2,0.9239898920059204,-0.11657094798660039,-10.821619556913674,-8.344202898550748,-6.147306843267131,-3.0760029676017915,-8.220414395745024,-0.03946466957908605,base; change; changing; climate; erosion; finding; fixed; human; increased; need; region; waste; western,address; agriculture; both; challenge; class; combination; completed; condition; continued; degradation; demand; environmental; exponential; flow; following; further; harvesting; identify; impact; include; infrastructure; language; level; modern; network; numerous; planning; potential; previous; provide; rapid; sector; sequence,compare; entry; environment; farming; shape; trained; use,erosion; finding; increased; need; western
everest,llm_simplification,openai::openai/gpt-5.2::few_shot::temp=0.5,0.9341790676116943,-0.0035096778805978335,-18.79220779220782,-8.154059956323238,-6.642967220625621,-3.0138613745463054,-9.19052907366708,-0.040684027589902944,base; change; changing; climate; condition; continued; erosion; fixed; human; increased; language; level; network; region; waste; western,address; agriculture; both; challenge; class; combination; completed; degradation; demand; environmental; exponential; finding; flow; following; further; harvesting; identify; impact; include; infrastructure; modern; need; numerous; planning; potential; previous; provide; rapid; sector; sequence,affect; compare; effect; entry; environment; farming; needed; study; trained,changing; condition; continued; erosion; increased; language; network; western
everest,llm_simplification,openai::openai/gpt-5.2::chain_of_thought::temp=0.0,0.9577925205230713,-0.27018150423526033,-15.449742038783143,-13.82483407828795,-12.118259224219514,-3.023968089891941,-2.0119905138742666,-0.03590795169742539,address; agriculture; base; challenge; change; changing; class; climate; condition; demand; environmental; erosion; finding; fixed; further; human; increased; language; level; need; planning; region; waste; western,both; combination; completed; continued; degradation; exponential; flow; following; harvesting; identify; impact; include; infrastructure; modern; network; numerous; potential; previous; provide; rapid; sector; sequence,growth; low; working,agriculture; challenge; class; condition; demand; environmental; erosion; finding; further; increased; language; need; planning; western
everest,llm_simplification,openai::openai/gpt-5.2::chain_of_thought::temp=0.2,0.9583554267883301,-0.279048005359525,-9.9764183185236,-12.214948835486439,-9.983619527632925,-3.1874553580159954,-4.198472131682053,-0.03375038386480034,address; agriculture; base; both; challenge; change; changing; class; climate; condition; demand; erosion; fixed; further; harvesting; human; increased; language; level; modern; need; region; waste; western,combination; completed; continued; degradation; environmental; exponential; finding; flow; following; identify; impact; include; infrastructure; network; numerous; planning; potential; previous; provide; rapid; sector; sequence,effect; environment; growth,agriculture; both; challenge; class; condition; demand; erosion; further; harvesting; increased; language; modern; need; western
everest,llm_simplification,openai::openai/gpt-5.2::chain_of_thought::temp=0.5,0.9456695318222046,-0.20270909081606917,-8.753746253746272,-9.63986896328197,-7.670935161851219,-3.1245424545424534,-9.888480627862137,-0.03760795642622852,base; both; challenge; change; changing; class; climate; demand; environmental; erosion; finding; fixed; human; increased; level; need; network; region; waste; western,address; agriculture; combination; completed; condition; continued; degradation; exponential; flow; following; further; harvesting; identify; impact; include; infrastructure; language; modern; numerous; planning; potential; previous; provide; rapid; sector; sequence,conflict; effect; entry; farming; working,both; challenge; class; demand; environmental; erosion; finding; increased; need; network; western
loterry,llm_simplification,openai::openai/gpt-5.2::zero_shot::temp=0.0,0.9367089867591858,1.3164544649035355,-42.211363636363615,14.683075480543835,20.090909090909065,-2.3562413766144417,14.073797234113613,-0.028279629974545223,analysis; domestic; economics; effect; employ; need; product; range; report; research; study; table; total; voluntary,anticipated; author; employed; existing; further; generating; however; likely; measurable; proportion; purchased; supported; transform; use,change; contact; expected; important; increased; working,analysis; domestic; economics; employ; need; product; range; report; research; table; voluntary
loterry,llm_simplification,openai::openai/gpt-5.2::zero_shot::temp=0.2,0.9175668954849243,0.8909973577935371,-49.80060975609757,0.4067929868700162,6.568713450292421,-3.0248246663705523,8.498725673281683,-0.040592061000224264,economics; effect; employ; need; range; report; research; study; table; total,analysis; anticipated; author; domestic; employed; existing; further; generating; however; likely; measurable; product; proportion; purchased; supported; transform; use; voluntary,change; expected; important; working,economics; employ; need; range; report; research; table
loterry,llm_simplification,openai::openai/gpt-5.2::zero_shot::temp=0.5,0.9414713382720947,0.8754838302438787,-32.87378048780488,8.034122179416613,11.393274853801188,-2.974615113988179,5.424563621718832,-0.03223443223443223,economics; effect; employ; further; need; range; report; research; study; table; voluntary,analysis; anticipated; author; domestic; employed; existing; generating; however; likely; measurable; product; proportion; purchased; supported; total; transform; use,chosen; expected; group; important; working,economics; employ; need; range; report; research; table; voluntary
loterry,llm_simplification,openai::openai/gpt-5.2::few_shot::temp=0.0,0.9348794221878052,0.791381697643496,-38.13749999999999,2.453289356391508,8.425324675324703,-3.1570161361466127,2.0024434804313103,-0.04691333131700104,analysis; economics; effect; employ; further; need; range; report; research; study; table,anticipated; author; domestic; employed; existing; generating; however; likely; measurable; product; proportion; purchased; supported; total; transform; use; voluntary,expected; important; working,analysis; economics; employ; need; range; report; research; table
loterry,llm_simplification,openai::openai/gpt-5.2::few_shot::temp=0.2,0.9394806623458862,0.4275463134162386,-30.03012820512822,-2.96127085254426,1.4800613496932442,-2.8631131377035963,-0.17509094752016097,-0.03902085938014081,author; economics; effect; employ; further; need; range; report; research; study; supported; table; voluntary,analysis; anticipated; domestic; employed; existing; generating; however; likely; measurable; product; proportion; purchased; total; transform; use,expected; important; working,author; economics; employ; need; range; report; research; supported; table; voluntary
loterry,llm_simplification,openai::openai/gpt-5.2::few_shot::temp=0.5,0.9389760494232178,0.8441985636032288,-43.37045454545455,2.140747438215783,7.448324022346355,-3.3156307319352756,7.880987156104965,-0.041264211293029734,economics; effect; employ; need; range; report; research; study; table,analysis; anticipated; author; domestic; employed; existing; further; generating; however; likely; measurable; product; proportion; purchased; supported; total; transform; use; voluntary,expected; important; working,economics; employ; need; range; report; research; table
loterry,llm_simplification,openai::openai/gpt-5.2::chain_of_thought::temp=0.0,0.9436640739440918,0.6163875869285088,-30.780555555555566,1.2941865916549204,6.32471264367814,-2.5707262250992926,4.809046197394437,-0.028676379799975296,analysis; author; domestic; economics; effect; employ; further; need; product; range; report; research; study; supported; table; total,anticipated; employed; existing; generating; however; likely; measurable; proportion; purchased; transform; use; voluntary,expected; important; working,analysis; author; domestic; economics; employ; need; product; range; report; research; supported; table
loterry,llm_simplification,openai::openai/gpt-5.2::chain_of_thought::temp=0.2,0.9369077682495117,0.7572094415330574,-36.068902439024384,4.016169865251129,6.8852941176470495,-2.3761111315144596,-7.479325198266622,-0.017895512308920128,analysis; author; domestic; economics; effect; employ; further; measurable; need; product; range; report; research; study; supported; table,anticipated; employed; existing; generating; however; likely; proportion; purchased; total; transform; use; voluntary,change; common; expected; group; important; working,analysis; author; domestic; economics; employ; measurable; need; product; range; report; research; supported; table
loterry,llm_simplification,openai::openai/gpt-5.2::chain_of_thought::temp=0.5,0.9451318979263306,0.9558702091447877,-35.55833333333334,9.249405446873766,12.258474576271169,-2.710824376423858,4.618829658532661,-0.02586739103593036,analysis; domestic; economics; effect; employ; existing; further; need; product; range; report; research; study; supported; table; total,anticipated; author; employed; generating; however; likely; measurable; proportion; purchased; transform; use; voluntary,expected; important; working,analysis; domestic; economics; employ; existing; need; product; range; report; research; supported; table
wnl 101 year old bottle message,llm_simplification,openai::openai/gpt-5.2::zero_shot::temp=0.0,0.9641351699829102,1.2664145149072996,-28.195884146341484,20.4195318907324,22.79299191374662,-3.19129660327701,-8.19399431642546,-0.01616982350408954,address; card; condition; culture; display; document; given; group; international; nature; received; researcher,appreciation; attempt; author; available; incur; known; note; science,learned,condition; culture; display; document; group; international; nature; received; researcher
wnl 101 year old bottle message,llm_simplification,openai::openai/gpt-5.2::zero_shot::temp=0.2,0.972997784614563,1.0701889975300385,-25.44404591104734,16.985647593211752,18.320464441219144,-3.370846584620395,-13.64370815764137,-0.007615624576156249,address; card; condition; culture; document; given; group; international; nature; note; received; researcher,appreciation; attempt; author; available; display; incur; known; science,both; emotional; history; learned,condition; culture; document; group; international; nature; note; received; researcher
wnl 101 year old bottle message,llm_simplification,openai::openai/gpt-5.2::zero_shot::temp=0.5,0.9718543291091919,1.035813533342567,-26.117336849044193,16.86366412213738,16.266588356214697,-3.1984775730507415,-14.494342352306866,-0.014935942413138954,address; card; condition; culture; display; given; group; international; nature; note; received; researcher,appreciation; attempt; author; available; document; incur; known; science,emotional; history; learned,condition; culture; display; group; international; nature; note; received; researcher
wnl 101 year old bottle message,llm_simplification,openai::openai/gpt-5.2::few_shot::temp=0.0,0.9751789569854736,1.0786914391659552,-23.100348432055796,19.493533117770596,18.214819013685315,-3.685511551289977,-18.145799808856253,-0.011216407355021218,address; card; condition; culture; display; document; given; group; international; nature; note; received; researcher,appreciation; attempt; author; available; incur; known; science,history; learned,condition; culture; display; document; group; international; nature; note; received; researcher
wnl 101 year old bottle message,llm_simplification,openai::openai/gpt-5.2::few_shot::temp=0.2,0.9508501291275024,1.170334649040048,-27.898505114083434,18.611437047901575,19.948892534864683,-4.133783342983982,-12.608931434017379,-0.01467717194254637,address; appreciation; card; condition; culture; document; given; group; international; nature; note; researcher,attempt; author; available; display; incur; known; received; science,both; learned,appreciation; condition; culture; document; group; international; nature; note; researcher
wnl 101 year old bottle message,llm_simplification,openai::openai/gpt-5.2::few_shot::temp=0.5,0.9590019583702087,0.9859874885839907,-24.03228120516502,15.627919441286338,16.46696938855399,-4.104064879277146,-12.520962870150328,-0.011346647485261346,address; card; condition; culture; display; document; given; group; international; nature; researcher,appreciation; attempt; author; available; incur; known; note; received; science,both; emotional; learned,condition; culture; display; document; group; international; nature; researcher
wnl 101 year old bottle message,llm_simplification,openai::openai/gpt-5.2::chain_of_thought::temp=0.0,0.9610915184020996,0.9055427620578692,-18.876172607879937,15.131997455470696,16.764207265559037,-3.205578076028715,-7.341792578439595,-0.008087505408638555,address; card; condition; culture; document; given; group; international; nature; note; received; researcher; science,appreciation; attempt; author; available; display; incur; known,both; emotional; history; learned,condition; culture; document; group; international; nature; note; received; researcher; science
wnl 101 year old bottle message,llm_simplification,openai::openai/gpt-5.2::chain_of_thought::temp=0.2,0.964748203754425,0.7943590680852741,-17.43963414634146,13.576335877862562,13.793526959225517,-3.1506325596587814,-4.564557393916019,-0.0030845392231530835,address; card; condition; culture; display; document; given; group; international; known; nature; note; received; researcher; science,appreciation; attempt; author; available; incur,both; history; learned; provide,condition; culture; display; document; group; international; known; nature; note; received; researcher; science
wnl 101 year old bottle message,llm_simplification,openai::openai/gpt-5.2::chain_of_thought::temp=0.5,0.9689332246780396,0.8799386186149726,-14.560975609756099,16.412125660598917,17.532863981976902,-3.058194289180644,-9.453973895193059,-0.008950895089508956,address; available; card; condition; culture; display; document; given; group; international; nature; note; received; researcher; science,appreciation; attempt; author; incur; known,both; history; learned,available; condition; culture; display; document; group; international; nature; note; received; researcher; science
wnl billionaires,llm_simplification,openai::openai/gpt-5.2::zero_shot::temp=0.0,0.9441509246826172,-0.013277529186712655,-19.849301825993564,-10.889743958573092,-5.456546240543446,-3.5599532096317823,-24.851478360996737,-0.018430574400723657,address; culture; example; following; marked; mosaic; nature; valuable; wealth,above; calculated; century; evidence; extent; however; minority; nevertheless; previous; prohibitive; repeated; reveal; working,condition; greek,address; culture; example; following; marked; mosaic; nature; valuable
wnl billionaires,llm_simplification,openai::openai/gpt-5.2::zero_shot::temp=0.2,0.9398232698440552,-0.13355493796334494,-20.090460903462542,-13.566385372714478,-9.097451988507487,-3.918655475380163,-41.353627658066046,-0.015445499773857986,address; culture; example; marked; mosaic; nature; previous; valuable; wealth,above; calculated; century; evidence; extent; following; however; minority; nevertheless; prohibitive; repeated; reveal; working,change; condition; greek; whole,address; culture; example; marked; mosaic; nature; previous; valuable
wnl billionaires,llm_simplification,openai::openai/gpt-5.2::zero_shot::temp=0.5,0.9342657923698425,0.2338142484047283,-29.518320964749535,-7.050092188774272,-3.9247657809860357,-4.033245712862463,-20.582006662811267,-0.02123275111172237,address; culture; example; marked; nature; valuable; wealth,above; calculated; century; evidence; extent; following; however; minority; mosaic; nevertheless; previous; prohibitive; repeated; reveal; working,include; outward,address; culture; example; marked; nature; valuable
wnl billionaires,llm_simplification,openai::openai/gpt-5.2::few_shot::temp=0.0,0.9380139708518982,-0.006931957682751122,-27.164965986394577,-12.74039330922244,-8.845106141630197,-3.603777127577608,-54.953885539269464,-0.01877131443047842,address; culture; example; following; marked; mosaic; nature; valuable,above; calculated; century; evidence; extent; however; minority; nevertheless; previous; prohibitive; repeated; reveal; wealth; working,group; outward,address; culture; example; following; marked; mosaic; nature; valuable
wnl billionaires,llm_simplification,openai::openai/gpt-5.2::few_shot::temp=0.2,0.9414151310920715,0.09511540089735804,-19.337651914698483,-6.8632452760961655,-3.3962639109698216,-3.761871620176141,-33.08594747144821,-0.016214944475814043,address; culture; example; marked; mosaic; nature; previous; valuable; wealth,above; calculated; century; evidence; extent; following; however; minority; nevertheless; prohibitive; repeated; reveal; working,greek; group; outward,address; culture; example; marked; mosaic; nature; previous; valuable
wnl billionaires,llm_simplification,openai::openai/gpt-5.2::few_shot::temp=0.5,0.9465737342834473,0.06739373268193904,-13.135404723687259,-4.831144908369538,-2.02114072148197,-3.6215151990066836,-39.925574040701264,-0.019000624309657592,culture; example; following; marked; nature; previous; valuable; wealth,above; address; calculated; century; evidence; extent; however; minority; mosaic; nevertheless; prohibitive; repeated; reveal; working,center; material,culture; example; following; marked; nature; previous; valuable
