story_key,comparison_type,variant,semantic_similarity_sbert,delta_cli,delta_aoa,delta_concreteness,delta_imageability,delta_fk_grade,delta_mtld,delta_tier2_proxy_token_ratio,tier2_types_retained,tier2_types_removed,tier2_types_added,low_frequency_tier2_types_retained
wnl shark,llm_simplification,openai::openai/gpt-5.2::few_shot::temp=0.2,0.943558931350708,-0.16064444872535694,-7.548129466162209,-5.390654054491051,-8.525438596491256,-4.3364787893233085,-18.297725805294903,-0.017767785080133755,changing; difference; evidence; human; increase; policy; population; reduce; related; society; state; university; western; whole,achieve; activity; approach; argue; consistent; counterproductive; encourage; exist; globally; however; increasing; indiscriminate; ineffective; nature; positive; potential; potentially; previous; provide; result; scheme; solely,fixed; justified; linked; meaning; need; ongoing,changing; difference; reduce; related; society; university; whole
wnl shark,llm_simplification,openai::openai/gpt-5.2::few_shot::temp=0.5,0.9553705453872681,-0.7783383659197376,11.575165678409519,-15.169749680880955,-15.8807957393484,-4.298472837314062,-9.182341286080913,-0.025213956550362085,approach; counterproductive; difference; encourage; evidence; exist; however; human; ineffective; policy; population; reduce; related; scheme; society; state; university; western; whole,achieve; activity; argue; changing; consistent; globally; increase; increasing; indiscriminate; nature; positive; potential; potentially; previous; provide; result; solely,change; justified; linked; meaning; total,approach; counterproductive; difference; encourage; exist; however; reduce; related; scheme; society; university; whole
wnl shark,llm_simplification,openai::openai/gpt-5.2::chain_of_thought::temp=0.0,0.9414337277412415,-0.5118661017686963,3.49599695005719,-10.3024136515034,-13.160035752889314,-4.3039915794790815,-15.020538416381726,-0.027962764052989628,difference; encourage; evidence; however; human; policy; population; reduce; related; society; state; university; western; whole,achieve; activity; approach; argue; changing; consistent; counterproductive; exist; globally; increase; increasing; indiscriminate; ineffective; nature; positive; potential; potentially; previous; provide; result; scheme; solely,group; intended; justified; linked; meaning; ongoing,difference; encourage; however; reduce; related; society; university; whole
wnl shark,llm_simplification,openai::openai/gpt-5.2::chain_of_thought::temp=0.2,0.9477999210357666,-0.9449033326364333,11.107080572026518,-19.139728575656363,-20.786672076667458,-4.039964059728284,-7.285865745789408,-0.03328403825298236,approach; difference; evidence; however; human; increase; ineffective; policy; population; reduce; related; society; state; university; western,achieve; activity; argue; changing; consistent; counterproductive; encourage; exist; globally; increasing; indiscriminate; nature; positive; potential; potentially; previous; provide; result; scheme; solely; whole,effect; intended; justified; linked; total,approach; difference; however; increase; reduce; related; society; university
wnl shark,llm_simplification,openai::openai/gpt-5.2::chain_of_thought::temp=0.5,0.9494040012359619,-0.8390035412814258,6.426229508196741,-17.49803879541315,-20.51877192982454,-4.322093840369831,-16.385902974603056,-0.03346447012539956,difference; encourage; evidence; however; human; increase; policy; population; reduce; related; society; state; university; western; whole,achieve; activity; approach; argue; changing; consistent; counterproductive; exist; globally; increasing; indiscriminate; ineffective; nature; positive; potential; potentially; previous; provide; result; scheme; solely,justified; linked; meaning; total,difference; encourage; however; increase; reduce; related; society; university; whole
