story_key,comparison_type,variant,semantic_similarity_sbert,delta_cli,delta_aoa,delta_concreteness,delta_imageability,delta_fk_grade,delta_mtld,delta_tier2_proxy_token_ratio,tier2_types_retained,tier2_types_removed,tier2_types_added,low_frequency_tier2_types_retained
anita,human_reference,human::elementary,0.7540255188941956,0.49636319465703194,-7.199999999999989,9.172724730882123,10.706168831168782,-2.340560086853074,-25.183789954337897,-0.05215898280702568,african; asian; bridge; census; change; class; cultural; discussion; image; important; inequality; link; natural; need; population,ancestry; apparent; attitude; complex; contrast; cycle; define; defined; demographic; discrimination; diversity; equality; explicit; goal; however; largely; latent; lecturer; likely; mainstream; minority; periphery; predominantly; prejudice; profoundly; project; publication; racial; relatively; result; social; society; sound; statistics; successful; suggestive; support; university,difference,asian; bridge; census; class; cultural; discussion; important; inequality; link; natural
copyright,human_reference,human::elementary,0.976621150970459,0.6465776365532824,-33.911764705882376,5.0331610942249085,2.1795463805513577,-2.287435221783049,-14.111369843868118,-0.0320660252994138,achieve; article; author; creative; creatively; dialogue; existing; group; index; influence; level; mp; need; poverty; society; subject; technology,acquired; analogue; approach; collected; content; critical; data; default; distribute; emerge; established; form; highly; independent; intellectual; principle; robust; scale; science; technical,change; discuss; organization; strongly; support,achieve; author; creatively; dialogue; existing; group; influence; level; poverty; society; subject; technology
crowdfunding,human_reference,human::elementary,0.8555333018302917,1.0127972535952454,-62.36703741152684,2.604089856812095,1.3559890994673651,-2.5814081912537326,-1.5161875115926335,-0.011122312920745385,activity; alternative; change; example; experience; finding; ground; international; project; successful; test; use; within,access; card; commercially; complex; conventional; efficient; expansion; focused; generate; growth; innovative; invention; known; limited; production; rejected; testing; transaction; validate; vital; weight; whole,european; group; important; increased; present; produce,activity; alternative; change; experience; finding; ground; international; successful
everest,human_reference,human::elementary,0.8071264028549194,-0.10032811072354286,-10.30735930735932,-5.95479808639368,-7.107513332942631,-1.6830695912274862,-29.836489951864593,-0.014395640112776553,agriculture; base; both; change; changing; climate; combination; completed; continued; erosion; fixed; human; need; planning; previous; provide; region; waste,address; challenge; class; condition; degradation; demand; environmental; exponential; finding; flow; following; further; harvesting; identify; impact; include; increased; infrastructure; language; level; modern; network; numerous; potential; rapid; sector; sequence; western,effect; future; group; increase; study; trained; use,agriculture; both; changing; combination; completed; continued; erosion; need; planning; previous; provide
loterry,human_reference,human::elementary,0.928984522819519,0.8458308158706155,-16.756034482758594,14.564556962025279,15.91535433070868,-1.37989379528263,-9.75630888119106,-0.023143523143523137,economics; employ; employed; existing; likely; proportion; range; study; supported; table; total; voluntary,analysis; anticipated; author; domestic; effect; further; generating; however; measurable; need; product; purchased; report; research; transform; use,given; important; preferred; working,economics; employ; existing; likely; proportion; range; supported; table; voluntary
wnl 101 year old bottle message,human_reference,human::elementary,0.9543273448944092,0.40571378506470457,-19.528919860627184,3.3569974554707187,2.4689069078434613,-1.9622861081071648,-0.9390920930445219,-0.026710912849526713,address; card; condition; culture; display; document; known; received; researcher,appreciation; attempt; author; available; given; group; incur; international; nature; note; science,,condition; culture; display; document; known; received; researcher
wnl billionaires,human_reference,human::elementary,0.9279595613479614,0.18805407314745948,-24.947250086475265,-6.583052039381187,-3.2256302521008706,-3.325654126971731,-48.71928696509168,-0.020862470862470867,above; address; following; mosaic; nature,calculated; century; culture; evidence; example; extent; however; marked; minority; nevertheless; previous; prohibitive; repeated; reveal; valuable; wealth; working,control,above; address; following; mosaic; nature
wnl experience,human_reference,human::elementary,0.9342689514160156,0.7159250651914019,-17.449292452830207,12.311427009294675,11.09964540829435,-1.5134758379442097,-20.694212680420193,-0.007803374432186892,display; experience; group; internal; need; relationship; stress; territorial; territory; within,empathy; evidence; limited; practice; specialized; traumatic; vertically,,display; experience; group; need; relationship; stress; territorial; territory; within
wnl ten ideas,human_reference,human::elementary,0.9135313034057617,0.17797232451455158,8.801026957638044,6.898844560715077,8.941196817710136,-2.409118286358595,-92.05908580675123,-0.042751070918610176,above; experiment; ground; project; similar; solution; sustainable; system; technology,act; change; climate; concept; conventional; convert; cycle; disperse; facility; harvesting; increasingly; industrial; innovation; international; movement; provide; scale; type; urban,group; need,experiment; project; similar; solution; sustainable
wnl why we should,human_reference,human::elementary,0.889441967010498,0.44214333415519913,-13.537373737373741,6.717675635276578,5.626206024857822,-4.423147617719515,-58.43841941125079,-0.026791898706120296,effect; environment; environmental; human; importance; improve; need; period; process; produce; reduce; reduced; use; valuable; vital; whole,adjustment; argue; challenge; equilibrium; examine; frequent; functioning; however; initial; intensity; known; likely; natural; necessary; production; reduction; relatively; short; suggest; tend; typically,change; example; experiment; working,environment; environmental; human; importance; improve; need; period; process; produce; reduced; valuable
wnl are you a bad boyfriend,human_reference,human::elementary,0.869896650314331,0.5464078071590768,-19.444852941176464,4.217391304347814,8.602733195614178,-1.2176630434782574,-40.88679843232242,-0.005126085159156676,present; relationship; testing; typical,available; capitalist; couple; design; external; generating; result; sharing; social; valuable,connected; etc; university,present; testing; typical
wnl shark,human_reference,human::elementary,0.9424149990081787,-0.35648788558284067,-13.150693568726354,-17.14950873837057,-11.676580149002632,-2.4749475350301395,-31.794388016250906,-0.013693219223173153,achieve; activity; changing; counterproductive; difference; encourage; evidence; exist; human; increase; increasing; ineffective; population; reduce; related; result; society; state; university; western; whole,approach; argue; consistent; globally; however; indiscriminate; nature; policy; positive; potential; potentially; previous; provide; scheme; solely,chosen; increased; method; monitor; use; working,achieve; activity; counterproductive; difference; encourage; exist; increase; increasing; reduce; related; society; university; whole
anita,llm_simplification,openai::openai/gpt-5.2::zero_shot::temp=0.0,0.9218582510948181,0.5910356635757574,-26.417506631299716,4.351821125745232,5.559621389539416,-2.658370161287344,-3.9753653003043894,-0.018309343398777503,african; asian; bridge; census; change; class; define; defined; discrimination; equality; explicit; image; inequality; lecturer; link; mainstream; minority; need; periphery; population; prejudice; racial; social; society; sound; statistics; successful; suggestive; university,ancestry; apparent; attitude; complex; contrast; cultural; cycle; demographic; discussion; diversity; goal; however; important; largely; latent; likely; natural; predominantly; profoundly; project; publication; relatively; result; support,argue; common; difference; history; known; low; present; published; reduced,asian; bridge; census; define; defined; equality; explicit; inequality; lecturer; link; mainstream; minority; periphery; prejudice; statistics; successful; suggestive
anita,llm_simplification,openai::openai/gpt-5.2::zero_shot::temp=0.2,0.9558858275413513,0.4465660497785774,-23.052564102564077,1.9903230745674705,3.0963868003341304,-1.9576189608219678,8.990021477698448,-0.023400507240039475,african; ancestry; asian; attitude; bridge; census; change; class; cycle; define; defined; discrimination; diversity; equality; explicit; image; inequality; lecturer; likely; mainstream; minority; natural; need; periphery; population; prejudice; racial; social; society; sound; statistics; successful; support; university,apparent; complex; contrast; cultural; demographic; discussion; goal; however; important; largely; latent; link; predominantly; profoundly; project; publication; relatively; result; suggestive,common; focus; known; linked; present; production; reduced; shared,ancestry; asian; attitude; bridge; census; cycle; define; defined; diversity; equality; explicit; inequality; lecturer; mainstream; minority; natural; periphery; prejudice; statistics; successful; support
anita,llm_simplification,openai::openai/gpt-5.2::zero_shot::temp=0.5,0.9373374581336975,0.6285253024837647,-27.606911928651073,5.813873354278201,5.212546278565014,-2.192616903757653,-25.596347046386427,-0.03163511928976524,african; ancestry; asian; attitude; bridge; census; change; class; defined; discrimination; discussion; diversity; equality; explicit; image; inequality; lecturer; likely; minority; need; periphery; population; prejudice; racial; society; sound; statistics; successful; suggestive; support; university,apparent; complex; contrast; cultural; cycle; define; demographic; goal; however; important; largely; latent; link; mainstream; natural; predominantly; profoundly; project; publication; relatively; result; social,describe; known; linked; low; reduced; shared,ancestry; asian; attitude; bridge; census; defined; discussion; diversity; equality; lecturer; minority; periphery; prejudice; statistics; successful; suggestive
anita,llm_simplification,openai::openai/gpt-5.2::few_shot::temp=0.0,0.918433427810669,0.7585915930251526,-30.243424317617837,7.0425023827727955,8.515389082462207,-2.6736104547081965,-12.050994421537709,-0.027285453921128397,african; ancestry; asian; bridge; census; change; class; define; defined; discrimination; diversity; equality; explicit; image; inequality; likely; minority; natural; need; population; racial; society; sound; statistics; successful; suggestive; support; university,apparent; attitude; complex; contrast; cultural; cycle; demographic; discussion; goal; however; important; largely; latent; lecturer; link; mainstream; periphery; predominantly; prejudice; profoundly; project; publication; relatively; result; social,known; linked; low; present; published; reduced,ancestry; asian; bridge; census; define; defined; diversity; equality; explicit; inequality; minority; natural; statistics; successful; suggestive; support
anita,llm_simplification,openai::openai/gpt-5.2::few_shot::temp=0.2,0.9395503401756287,0.7001025128534837,-37.477427490542254,2.905684057670385,4.0688979184487835,-2.1950787920103068,-18.5,-0.026802085907122505,african; ancestry; asian; attitude; bridge; census; class; defined; discrimination; equality; explicit; image; inequality; lecturer; likely; link; mainstream; minority; natural; need; periphery; population; prejudice; racial; sound; statistics; successful; suggestive; support; university,apparent; change; complex; contrast; cultural; cycle; define; demographic; discussion; diversity; goal; however; important; largely; latent; predominantly; profoundly; project; publication; relatively; result; social; society,difference; known; low; mainly; present; reduced; shared,ancestry; asian; attitude; bridge; census; defined; equality; explicit; inequality; lecturer; link; minority; natural; periphery; prejudice; statistics; successful; suggestive; support
anita,llm_simplification,openai::openai/gpt-5.2::few_shot::temp=0.5,0.90730220079422,0.5714413951221367,-29.035897435897425,4.608071992316354,2.467101511263138,-2.236328065338707,-22.2032237022796,-0.023394930881568854,african; ancestry; asian; attitude; bridge; census; change; class; define; defined; discrimination; diversity; equality; explicit; image; inequality; likely; link; minority; natural; need; periphery; population; racial; society; sound; statistics; successful; suggestive; support; university,apparent; complex; contrast; cultural; cycle; demographic; discussion; goal; however; important; largely; latent; lecturer; mainstream; predominantly; prejudice; profoundly; project; publication; relatively; result; social,accepted; common; known; level; low; mainly; present; reduced; shared,ancestry; asian; attitude; bridge; census; define; defined; diversity; equality; explicit; inequality; link; minority; natural; periphery; statistics; successful; suggestive; support
anita,llm_simplification,openai::openai/gpt-5.2::chain_of_thought::temp=0.0,0.9471563100814819,0.4423367761586071,-29.185897435897402,0.0019172774660205505,0.17992658158362929,-2.116739973988828,-21.283433866060335,-0.028406122162892344,african; ancestry; asian; bridge; census; class; defined; discrimination; diversity; equality; explicit; image; inequality; lecturer; likely; minority; need; periphery; population; prejudice; racial; social; society; statistics; successful; suggestive; support; university,apparent; attitude; change; complex; contrast; cultural; cycle; define; demographic; discussion; goal; however; important; largely; latent; link; mainstream; natural; predominantly; profoundly; project; publication; relatively; result; sound,argue; difference; known; linked; low; mainly; perform; present; published; reduced; strongly,ancestry; asian; bridge; census; defined; diversity; equality; explicit; inequality; lecturer; minority; periphery; prejudice; statistics; successful; suggestive; support
anita,llm_simplification,openai::openai/gpt-5.2::chain_of_thought::temp=0.2,0.9526429176330566,0.7037303607040692,-36.88703898840885,3.4295431720552756,4.210465529495366,-2.4838089677428243,-37.5530303030303,-0.02242578456318914,african; ancestry; asian; attitude; bridge; census; class; cycle; defined; discrimination; diversity; equality; explicit; image; inequality; likely; link; mainstream; minority; natural; need; periphery; population; prejudice; racial; social; society; sound; statistics; successful; suggestive; support; university,apparent; change; complex; contrast; cultural; define; demographic; discussion; goal; however; important; largely; latent; lecturer; predominantly; profoundly; project; publication; relatively; result,argue; difference; harmful; known; level; low; present; reduced; shared; subject,ancestry; asian; attitude; bridge; census; cycle; defined; diversity; equality; explicit; inequality; link; mainstream; minority; natural; periphery; prejudice; statistics; suggestive; support
anita,llm_simplification,openai::openai/gpt-5.2::chain_of_thought::temp=0.5,0.9453333616256714,0.8296441821574218,-27.31843711843709,10.43476751901187,11.087614870509583,-2.4148315580079647,-16.737894548063124,-0.022433142914918353,african; ancestry; asian; attitude; bridge; census; change; class; defined; discrimination; equality; explicit; image; inequality; lecturer; likely; mainstream; minority; natural; need; periphery; population; prejudice; racial; social; society; sound; statistics; successful; suggestive; university,apparent; complex; contrast; cultural; cycle; define; demographic; discussion; diversity; goal; however; important; largely; latent; link; predominantly; profoundly; project; publication; relatively; result; support,argue; difference; focus; group; known; linked; low; mainly; reduced; shared,ancestry; asian; attitude; bridge; census; defined; equality; explicit; inequality; lecturer; minority; natural; periphery; prejudice; statistics; successful; suggestive
copyright,llm_simplification,openai::openai/gpt-5.2::zero_shot::temp=0.0,0.9298520684242249,0.6057210562616312,-24.54000000000002,4.668772775361447,7.362650951090529,-3.7691704067321155,1.9166580987748318,-0.03008532560573131,analogue; article; author; collected; content; creative; data; group; index; influence; intellectual; mp; need; poverty; science; society; technology,achieve; acquired; approach; creatively; critical; default; dialogue; distribute; emerge; established; existing; form; highly; independent; level; principle; robust; scale; subject; technical,affect; control; known; strongly; support,analogue; author; collected; data; group; influence; intellectual; poverty; society; technology
copyright,llm_simplification,openai::openai/gpt-5.2::zero_shot::temp=0.2,0.9198912382125854,0.16729236500197353,-21.760869565217376,-4.184119456549638,-4.041148600143572,-3.734347826086953,27.216375808991046,-0.024062194951889562,analogue; article; author; collected; content; creative; data; dialogue; existing; index; influence; intellectual; mp; need; poverty; science; society; technology,achieve; acquired; approach; creatively; critical; default; distribute; emerge; established; form; group; highly; independent; level; principle; robust; scale; subject; technical,current; needed; sharing; strongly; system; use,analogue; author; collected; data; dialogue; existing; influence; intellectual; poverty; society; technology
copyright,llm_simplification,openai::openai/gpt-5.2::zero_shot::temp=0.5,0.9181591272354126,0.774403001514717,-35.166666666666686,5.922563087580386,6.68424997917765,-2.8212791516630418,9.996609521098918,-0.03638613861386139,analogue; article; author; collected; content; creative; data; dialogue; index; intellectual; mp; poverty; science; society; technology,achieve; acquired; approach; creatively; critical; default; distribute; emerge; established; existing; form; group; highly; independent; influence; level; need; principle; robust; scale; subject; technical,common; control; needed; sharing; strongly; support,analogue; author; collected; data; dialogue; intellectual; poverty; society; technology
copyright,llm_simplification,openai::openai/gpt-5.2::few_shot::temp=0.0,0.9341713190078735,0.37159475067401293,-18.46078431372547,0.9322988795165088,3.7474228284278297,-3.966037024320123,-17.18288306635114,-0.027116475692513076,analogue; approach; article; author; collected; content; creative; data; dialogue; group; index; influence; intellectual; mp; need; poverty; science; society; technology,achieve; acquired; creatively; critical; default; distribute; emerge; established; existing; form; highly; independent; level; principle; robust; scale; subject; technical,affect; control; sharing; strongly; support,analogue; approach; author; collected; data; dialogue; group; influence; intellectual; poverty; society; technology
copyright,llm_simplification,openai::openai/gpt-5.2::few_shot::temp=0.2,0.9340829253196716,0.7707129039995069,-29.923076923076906,7.236516575952464,9.165884366889372,-3.682610983981693,1.5724564654592825,-0.015611490726537447,analogue; article; author; collected; content; creative; data; dialogue; group; index; influence; intellectual; mp; need; poverty; science; society; subject; technology,achieve; acquired; approach; creatively; critical; default; distribute; emerge; established; existing; form; highly; independent; level; principle; robust; scale; technical,affect; control; current; known; sharing; strongly; support,analogue; author; collected; data; dialogue; group; influence; intellectual; poverty; society; subject; technology
copyright,llm_simplification,openai::openai/gpt-5.2::few_shot::temp=0.5,0.9218333959579468,0.253817678217247,-14.949999999999989,0.021172298706687798,1.3979585427135248,-3.9321954956587604,1.8591793961240342,-0.0202096680256261,analogue; approach; article; author; content; creative; data; dialogue; group; index; influence; intellectual; mp; need; poverty; science; subject; technology,achieve; acquired; collected; creatively; critical; default; distribute; emerge; established; existing; form; highly; independent; level; principle; robust; scale; society; technical,active; affect; current; imagined; sharing; strongly; support,analogue; approach; author; data; dialogue; group; influence; intellectual; poverty; subject; technology
copyright,llm_simplification,openai::openai/gpt-5.2::chain_of_thought::temp=0.0,0.9709830284118652,-0.16540629257999395,-10.427272727272737,-8.177369945416103,-8.381063734514157,-3.1996385424377394,-6.379869430724199,-0.015563042790765563,analogue; approach; article; author; collected; content; creative; critical; data; default; dialogue; distribute; existing; group; independent; index; influence; intellectual; level; mp; need; poverty; science; society; subject; technology,achieve; acquired; creatively; emerge; established; form; highly; principle; robust; scale; technical,affect; change; needed; result; strongly,analogue; approach; author; collected; critical; data; default; dialogue; distribute; existing; group; independent; influence; intellectual; level; poverty; society; subject
copyright,llm_simplification,openai::openai/gpt-5.2::chain_of_thought::temp=0.2,0.953901469707489,0.07678321112518804,-17.69607843137254,-4.1881575870937695,-5.467569807801908,-3.788613091128333,-14.19075885780525,-0.02330323705945725,analogue; approach; article; author; collected; content; creative; data; dialogue; existing; group; independent; index; influence; intellectual; mp; poverty; science; society; technology,achieve; acquired; creatively; critical; default; distribute; emerge; established; form; highly; level; need; principle; robust; scale; subject; technical,active; affect; common; known; needed; strongly; support,analogue; approach; author; collected; data; dialogue; existing; group; independent; influence; intellectual; poverty; society; technology
copyright,llm_simplification,openai::openai/gpt-5.2::chain_of_thought::temp=0.5,0.9449994564056396,0.353434646523495,-21.982142857142833,0.5426740812378625,0.6395808831391037,-2.841795564206201,3.3409876530073745,-0.0187935460212688,analogue; approach; article; author; collected; content; creative; data; dialogue; group; independent; index; influence; intellectual; mp; need; science; society; technology,achieve; acquired; creatively; critical; default; distribute; emerge; established; existing; form; highly; level; poverty; principle; robust; scale; subject; technical,active; control; current; needed; shape; sharing; strongly; support,analogue; approach; author; collected; data; dialogue; group; independent; influence; intellectual; society; technology
crowdfunding,llm_simplification,openai::openai/gpt-5.2::zero_shot::temp=0.0,0.8490843176841736,1.1527825035594603,-49.07246376811594,12.315298620815327,9.231487976168864,-4.189455152808463,16.91906908302191,-0.016221920361035952,activity; card; change; efficient; focused; international; invention; project; rejected; test; testing,access; alternative; commercially; complex; conventional; example; expansion; experience; finding; generate; ground; growth; innovative; known; limited; production; successful; transaction; use; validate; vital; weight; whole; within,common; demand; expanding; goal; group; important; product; sending; support; useful,activity; card; change; efficient; focused; international; rejected; testing
crowdfunding,llm_simplification,openai::openai/gpt-5.2::zero_shot::temp=0.2,0.8312699794769287,1.0427606096084627,-49.41126158232362,10.54940352317027,5.207648476879285,-4.429960046203458,13.810936371763617,-0.019695001602591133,activity; card; change; focused; ground; international; invention; project; rejected; test; transaction,access; alternative; commercially; complex; conventional; efficient; example; expansion; experience; finding; generate; growth; innovative; known; limited; production; successful; testing; use; validate; vital; weight; whole; within,common; expanding; goal; group; important; interest; need; product; sending; support; waste; willingness,activity; card; change; focused; ground; international; rejected; transaction
crowdfunding,llm_simplification,openai::openai/gpt-5.2::zero_shot::temp=0.5,0.8201423287391663,1.101666094941113,-46.757312252964425,13.101368099146953,7.738960113960161,-4.362070519435843,6.151551670868827,-0.015388886919741482,activity; card; change; efficient; focused; ground; growth; international; invention; project; rejected; successful; test; use,access; alternative; commercially; complex; conventional; example; expansion; experience; finding; generate; innovative; known; limited; production; testing; transaction; validate; vital; weight; whole; within,common; goal; group; important; interest; need; product; received; sending; support; useful,activity; card; change; efficient; focused; ground; growth; international; invention; rejected; successful
